confusion_set	expected	target	suggestion	masked_sentence
Principal,principal,principle	principle	Principal	principal	Bird (pictured) has been sent for further medical checks after what Jaguar team [MASK] James Barclay called a 'nightmare scenario'
Principal,principal,principle	principle	principal	principal	Bird (pictured) has been sent for further medical checks after what Jaguar team [MASK] James Barclay called a 'nightmare scenario'
Principal,principal,principle	principle	Principal	principal	"Donald Trump took on directly Judge Engoron, suggesting right here upon leaving the courtroom that a mistrial should be called," Hillyard said, "on the basis that the communications between the [MASK] law clerk and judge were not right."
Principal,principal,principle	principle	principal	principal	"Donald Trump took on directly Judge Engoron, suggesting right here upon leaving the courtroom that a mistrial should be called," Hillyard said, "on the basis that the communications between the [MASK] law clerk and judge were not right."
Principal,principal,principle	principle	Principal	principal	Earlier on Monday, day 1 of the budget session, Congress, the [MASK] opposition party, raised an uproar demanding resignation of state minister Sandeep Singh over an ongoing sexual harassment case.
Principal,principal,principle	principle	principal	principal	Earlier on Monday, day 1 of the budget session, Congress, the [MASK] opposition party, raised an uproar demanding resignation of state minister Sandeep Singh over an ongoing sexual harassment case.
Principal,principal,principle	principle	principal	principal	“Either way, the impression given is that NATO actions are driven by strategic interest rather than [MASK]”…
Provence,Province,province	Provence	Province	Province	Home to “The Serpent Queen” and “The Nun II,” Martigues-based [MASK] Studios also hosts a number of soundstages, a backlot, and will open a new 3500 sq. yard facility next year.
Provence,Province,province	Provence	Province	Province	Under Rodolphe, the company has diversified into the media, buying newspapers like La Tribune and La [MASK].
Provence,Province,province	Provence	province	province	Under Rodolphe, the company has diversified into the media, buying newspapers like La Tribune and La [MASK].
Provence,Province,province	Province	Provence	Provence	For example, when you're in Guilin ([MASK]), they use osmanthus flowers to cook endless things.
Provence,Province,province	Province	Provence	Provence	Looking at the game itself, Van As bemoaned the tactical play from his side, as the visitors tried to run the ball from deep in their own half, instead of putting [MASK]’s outside backs under pressure with kicks on a slippery pitch.
Provence,Province,province	Province	Provence	Provence	[MASK] apologizes after learning Sask. service medal rec…
Provence,Province,province	Province	Provence	Provence	[MASK] commits $10.6 million to Pictou County’s High.
Provence,Province,province	Province	Provence	Provence	[MASK]’s arts community mourns loss of Mary White, known as ‘Whitey’
Provence,Province,province	Province	Provence	Provence	[MASK]’s criminalization of Wet’suwet’en land defenders is beyond shameful and egregious: BC.
Quiet,Quite,quiet,quite	Quiet	quite	quite	Coming from a community that oppressed her into silence, [MASK]'s wish is to find her place in this dark, chaotic world.
Quiet,Quite,quiet,quite	Quiet	Quite	Quite	Ferguson just wrote a column on Bloomberg titled “All is Not [MASK] on the Eastern Front” – basically to peddle the risk of WWIII, on behalf of his masters, blaming of course “China as the arsenal of autocracy”.
Quiet,Quite,quiet,quite	Quiet	quite	Quite	Ferguson just wrote a column on Bloomberg titled “All is Not [MASK] on the Eastern Front” – basically to peddle the risk of WWIII, on behalf of his masters, blaming of course “China as the arsenal of autocracy”.
Quiet,Quite,quiet,quite	Quiet	Quite	Quite	Glass Onion: A Knives Out MysteryAll [MASK] on the Western Front.
Quiet,Quite,quiet,quite	Quiet	quite	quite	Glass Onion: A Knives Out MysteryAll [MASK] on the Western Front.
Quiet,Quite,quiet,quite	Quiet	Quite	Quite	[MASK], but he knew how to make himself understood," Jacky Lorenzetti, the businessman president of Racing, told AFP.
Quiet,Quite,quiet,quite	Quiet	quite	Quite	[MASK], but he knew how to make himself understood," Jacky Lorenzetti, the businessman president of Racing, told AFP.
Quiet,Quite,quiet,quite	Quiet	Quite	Quite	[MASK] Hiring Is Here, But What is it and How Does it Impact Employees?
Quiet,Quite,quiet,quite	Quiet	quite	Quite	[MASK] Hiring Is Here, But What is it and How Does it Impact Employees?
Quiet,Quite,quiet,quite	Quiet	Quite	Quite	Setauket – Stunning New Construction Colonial-style Home, Situated On A [MASK] Cul-de-sac!
Quiet,Quite,quiet,quite	Quiet	quite	Quite	Setauket – Stunning New Construction Colonial-style Home, Situated On A [MASK] Cul-de-sac!
Quiet,Quite,quiet,quite	Quiet	Quite	Quite	Some Best Picture nomineesAll [MASK] on the Western FrontEverything Everywhere All at Once are just some of the people nominated for the prestigious acting awards this year.
Quiet,Quite,quiet,quite	Quiet	quite	quite	Some Best Picture nomineesAll [MASK] on the Western FrontEverything Everywhere All at Once are just some of the people nominated for the prestigious acting awards this year.
Quiet,Quite,quiet,quite	Quiet	Quite	Quite	Your Employees Might Be ‘[MASK] Quitting’ On Social Media.
Quiet,Quite,quiet,quite	Quiet	quite	Quite	Your Employees Might Be ‘[MASK] Quitting’ On Social Media.
Quiet,Quite,quiet,quite	Quite	Quiet	Quiet	In Fact, [MASK] The Opposite.
Quiet,Quite,quiet,quite	quiet	Quite	quite	A third TikTok user joked, “This is [MASK] quitting, lol.”
Quiet,Quite,quiet,quite	quiet	quite	quite	A third TikTok user joked, “This is [MASK] quitting, lol.”
Quiet,Quite,quiet,quite	quiet	quite	quite	Bitcoin ETF: The [MASK] 800-pound gorilla in the room is about to roarfinance.
Quiet,Quite,quiet,quite	quiet	quite	quite	But his fame was [MASK].
Quiet,Quite,quiet,quite	quiet	quite	quite	But it’s not as though the rest of the world is composed of [MASK] Luxembourgs: Whether we look at what happened in Germany in the 1940s or Rwanda in the 1990s or what Russia is doing now to Ukraine (and did to Chechnya), we are not unique.
Rise,raise,rise	Rise	raise	raise	Gamers can pick XRK [MASK] 50 for the gun’s stock to speed up their Sprint, Aim Down Sight, and Crouch Movement.
Rise,raise,rise	Rise	raise	raise	McVicar, of the village’s Affleck [MASK], was subsequently found bleeding, with the vehicle lying about four feet away from him.
Rise,raise,rise	Rise	raise	raise	Ohio Weekly Unemployment Claims Continue to [MASK] COLUMBUS, Ohio – Ohioans filed 15,123 initial traditional unemployment claims last week, which was 2,402 more than the previous week, the Ohio Department of Job and Family Services reported Thursday.
Rise,raise,rise	raise	rise	rise	A 46% pay [MASK].
Rise,raise,rise	raise	Rise	rise	Abdullahi said: ” We notice some areas of concern and hopefully by the time the National Assembly resume, we will [MASK] on its instrumentality to bring about solutions to some of the gaps that we have identified.
Rise,raise,rise	raise	rise	rise	Abdullahi said: ” We notice some areas of concern and hopefully by the time the National Assembly resume, we will [MASK] on its instrumentality to bring about solutions to some of the gaps that we have identified.
Rise,raise,rise	raise	Rise	rise	A big pay [MASK] for the most successful OC of Stoops’ tenure so far.
Rise,raise,rise	raise	rise	rise	A big pay [MASK] for the most successful OC of Stoops’ tenure so far.
Rise,raise,rise	raise	Rise	rise	Alex Harris, a lawyer and former Joshua Generation leader, defines the movement as "a decades-long multi-generational plan to [MASK] up an elite strike force of Christian homeschool graduates to infiltrate the highest levels of government."
Rise,raise,rise	raise	rise	rise	Alex Harris, a lawyer and former Joshua Generation leader, defines the movement as "a decades-long multi-generational plan to [MASK] up an elite strike force of Christian homeschool graduates to infiltrate the highest levels of government."
Rise,raise,rise	raise	rise	rise	All social welfare – including the cash handout – will remain unchanged next year, while civil servants will see a pay [MASK] from Jan.
Rise,raise,rise	raise	rise	rise	Also I would like to mention that following the presentation, there will be a question-and-answer session during which you can submit questions by selecting the [MASK] hand icon at the bottom of your screen.
Rise,raise,rise	raise	rise	rise	And next year we’ll be aiming to [MASK] more and come first!"
Rise,raise,rise	rise	raise	raise	A 10% [MASK] would mean a bill increase of about £195 a year for a band D property.
Rise,raise,rise	rise	raise	raise	A 17 per cent pay [MASK] will have a significant impact on retention.
Rise,raise,rise	rise	raise	raise	A bottle of £8 Barefoot Pinot Grigio wine, meanwhile, could [MASK] 44p.
Rise,raise,rise	rise	raise	raise	A brewing industry leader has called for a [MASK] in beer duty to be ruled out in Wednesday's Autumn Statement.
Rise,raise,rise	rise	raise	raise	A BT spokesman – speaking for BT, EE and Plusnet – said the average price [MASK] for customers will be around £1 a week, adding: ‘We are balancing our own rising costs due to high inflation and making vital digital infrastructure investments for the UK.’
Rise,raise,rise	rise	raise	raise	According to management, this 33.6% [MASK] was driven largely by the recovery following the COVID-19 pandemic that had negatively impacted sales in 2020.
Rise,raise,rise	rise	raise	raise	According to preliminary data from the federal statistics office, EU-harmonized prices increased by 9.3% YoY, exceeding analyst estimates of a 9.0% increase and slightly higher than January’s 9.2% [MASK].
Rise,raise,rise	rise	raise	raise	Adjusted EBITDA is expected to [MASK] 15% to $379 million, also down slightly from the prior expectation.
Rise,raise,rise	rise	raise	raise	After a break, we come to who wants us all to [MASK].
Rise,raise,rise	rise	raise	raise	After the initial [MASK], there is a decline before rates peak again at 3.54%, compared to 4.37% one week ago.
Rise,raise,rise	rise	raise	raise	“Ah,” you might think, “there could be a big minimum wage [MASK] coming from the Fair Work Commission.”
Rise,raise,rise	rise	raise	raise	All [MASK], we’ve got an announcement!
Rise,raise,rise	rise	raise	raise	Almost a year ago, Apple Music made the decision to raise the subscription price of its service by $1 from $9.99 to $10.99 as part of its price [MASK].
Rise,raise,rise	rise	raise	raise	Analysts at JPMorgan, on the other hand, stand with the majority and flag a [MASK] of 25 basis points in part because postponing a move until May would threaten the Fed's inflation-fighting credibility.
Rise,raise,rise	rise	raise	raise	And Kendrick said that if seas [MASK] more than a foot, the community may have to consider moving those community assets along Downstreet onto higher ground.
Rise,raise,rise	rise	raise	raise	And that of the remainder who will see a price [MASK], two-thirds of them will, on average, have to pay 'only' 11p an hour extra.
Rise,raise,rise	rise	raise	raise	An energy price cap which came into force in October has kept bills down to a lower level than in 2022 but there are still fears they could [MASK] come 2024.
Rise,raise,rise	rise	raise	raise	An increase by 100, 000 barrels per day in February, amounted to a [MASK] of 2.8 million barrels in the month.
Safe,Save,safe,save	Safe	Save	Save	All support the ballot initiative [MASK] Zones 4 Kids, which prioritizes the removal of unauthorized campsites near schools and pathways frequented by our city’s children.
Safe,Save,safe,save	Safe	save	Save	All support the ballot initiative [MASK] Zones 4 Kids, which prioritizes the removal of unauthorized campsites near schools and pathways frequented by our city’s children.
Safe,Save,safe,save	Safe	Save	Save	And, look, I think we found our way into this story because there is this group, [MASK] Street Rebel, that is going around and they’re putting traffic cones on the hoods of autonomous vehicles, which has the effect of disabling them.
Safe,Save,safe,save	Safe	Save	Save	A new General Officer Commanding, (GOC) 6 Division Nigerian Army/ Land Component Commander Joint Task Force (South-South) Operation Delta [MASK] has assumed Command.
Safe,Save,safe,save	Safe	save	save	A new General Officer Commanding, (GOC) 6 Division Nigerian Army/ Land Component Commander Joint Task Force (South-South) Operation Delta [MASK] has assumed Command.
Safe,Save,safe,save	Safe	Save	Save	A So-[MASK] Corps officer, Saheed Ogunrinde, alongside two others have been killed by suspected kidnappers.
Safe,Save,safe,save	Safe	save	Save	A So-[MASK] Corps officer, Saheed Ogunrinde, alongside two others have been killed by suspected kidnappers.
Safe,Save,safe,save	Safe	Save	Save	Bohan explained some of the other projects the Village [MASK] Water project is focusing on.
Safe,Save,safe,save	Safe	Save	Save	Booting in [MASK] Mode is a useful tool for troubleshooting operating system issues.
Safe,Save,safe,save	Safe	Save	Save	But Dan Becker, director of the Center for Biological Diversity’s [MASK] Climate Transport Campaign, argued that the proposal isn’t stringent enough.
Safe,Save,safe,save	Safe	Save	Save	Check the [MASK] Water Sports website for more information.
Safe,Save,safe,save	Safe	Save	Save	Children from the [MASK] Child Advocacy Care Home in Kumasi and the Angel of Hope Orphanage Care Home as well as other groups and individuals would participate in a competition.
Safe,Save,safe,save	Safe	save	Save	Children from the [MASK] Child Advocacy Care Home in Kumasi and the Angel of Hope Orphanage Care Home as well as other groups and individuals would participate in a competition.
Safe,Save,safe,save	Safe	Save	Save	"Continuation of the [MASK] Outdoor Spaces, SOS, does not really address the core issue of what you have out here today.
Safe,Save,safe,save	Safe	Save	Save	Dailymail.com has reached out to Everest Gym and [MASK] Sport for comment.
Safe,Save,safe,save	Safe	Save	Save	Dear Home [MASK]: When/if those twentysomethings have children, they’ll be much more concerned with the plight of a stranded parent.
Safe,Save,safe,save	Safe	save	save	Dear Home [MASK]: When/if those twentysomethings have children, they’ll be much more concerned with the plight of a stranded parent.
Safe,Save,safe,save	Safe	Save	Save	During the 2014 radio interview with [MASK] Space, a local show hosted by a Portland psychiatrist, Payzant said he grew up in the criminal justice system, having been charged with burglary and sentenced as an adult when he was 16.
Safe,Save,safe,save	Safe	Save	Save	During the same period, the most popular apps on Android for Filipino users of Kaspersky’s [MASK] Kids included YouTube (26.50%), TikTok (18.45%), and Messenger (14.85%).
Safe,Save,safe,save	Safe	save	Save	During the same period, the most popular apps on Android for Filipino users of Kaspersky’s [MASK] Kids included YouTube (26.50%), TikTok (18.45%), and Messenger (14.85%).
Safe,Save,safe,save	Safe	Save	Save	Her Inside [MASK] program is voluntary, and no one is forced into shelter.
Safe,Save,safe,save	Safe	Save	Save	IBM announced 'Quantum [MASK] Explorer' to enable organisations to scan source and object code to locate cryptographic assets, dependencies, vulnerabilities and to build a Cryptography Bill of Materials (CBOM).
Safe,Save,safe,save	Safe	save	Save	IBM announced 'Quantum [MASK] Explorer' to enable organisations to scan source and object code to locate cryptographic assets, dependencies, vulnerabilities and to build a Cryptography Bill of Materials (CBOM).
Safe,Save,safe,save	Safe	Save	Save	If that doesn't work, you may need to force your Mac into [MASK] Mode so you can run diagnostics on your startup disk and repair any corrupt files.
Safe,Save,safe,save	Safe	save	Save	If that doesn't work, you may need to force your Mac into [MASK] Mode so you can run diagnostics on your startup disk and repair any corrupt files.
Safe,Save,safe,save	Safe	Save	Save	If you are still having issues with your touchscreen after restarting and entering [MASK] Mode, it is likely that there may be a hardware issue with your device.
Safe,Save,safe,save	Safe	save	Save	If you are still having issues with your touchscreen after restarting and entering [MASK] Mode, it is likely that there may be a hardware issue with your device.
Safe,Save,safe,save	Safe	Save	Save	In 2002, Canada and the United States concluded a bilateral treaty known as the “[MASK] Third Country Agreement” (STCA).
Safe,Save,safe,save	Safe	save	Save	In 2002, Canada and the United States concluded a bilateral treaty known as the “[MASK] Third Country Agreement” (STCA).
Safe,Save,safe,save	Safe	Save	Save	Is That Valentine’s Day Chocolate [MASK]?
Safe,Save,safe,save	Safe	save	Save	Is That Valentine’s Day Chocolate [MASK]?
Safe,Save,safe,save	Safe	Save	Save	It is clear that work still needs to be done to address [MASK] Sport in Canada.
Safe,Save,safe,save	Safe	Save	Save	It is possible that your FileVault and/or Firmware password may be preventing your Mac from entering [MASK] Mode.
Safe,Save,safe,save	Safe	save	save	It is possible that your FileVault and/or Firmware password may be preventing your Mac from entering [MASK] Mode.
Safe,Save,safe,save	Safe	Save	Save	Last month, Bass and her Inside [MASK] team moved 43 people — including Parker — out of homeless encampments on or near 6th Street and Fairfax Avenue.
Safe,Save,safe,save	Safe	save	Save	Last month, Bass and her Inside [MASK] team moved 43 people — including Parker — out of homeless encampments on or near 6th Street and Fairfax Avenue.
Safe,Save,safe,save	Safe	Save	Save	Last week, Trudeau told reporters he expects to have something to announce about the [MASK] Third Country Agreement renegotiations in the coming months.
Safe,Save,safe,save	Safe	Save	Save	Liberty [MASK] said it had also “revised our policies around cooperation with law enforcement.”
Safe,Save,safe,save	Safe	Save	Save	Magnum Opus Acquisition has higher earnings, but lower revenue than SOBR [MASK].
Safe,Save,safe,save	Safe	save	save	Magnum Opus Acquisition has higher earnings, but lower revenue than SOBR [MASK].
Safe,Save,safe,save	Safe	Save	Save	Mayor Karen Bass declared a state of emergency to confront the homeless crisis and has rapidly moved people off the street through her “Inside [MASK]” program.
Safe,Save,safe,save	Safe	save	Save	Mayor Karen Bass declared a state of emergency to confront the homeless crisis and has rapidly moved people off the street through her “Inside [MASK]” program.
Safe,Save,safe,save	Safe	Save	Save	MedStar Health’s D.C. [MASK] Babies Safe Moms (SBSM) initiative wants to turn these preventable deaths into prevented deaths.
Safe,Save,safe,save	Safe	Save	Save	MedStar Health’s D.C. [MASK] Babies Safe Moms (SBSM) initiative wants to turn these preventable deaths into prevented deaths.
Safe,Save,safe,save	Safe	Save	Save	On the edge stood Mariah Parker, in the union’s bright red and gold T-shirt and baggy, mustard-colored pants, holding a banner that read “[MASK] Jobs Now.”
Safe,Save,safe,save	Safe	save	Save	On the edge stood Mariah Parker, in the union’s bright red and gold T-shirt and baggy, mustard-colored pants, holding a banner that read “[MASK] Jobs Now.”
Safe,Save,safe,save	Safe	Save	Save	Resources for the [MASK] Sleeping Village on 1515 South Van Ness Ave., a site for homeless tents that is partly covered and partly exposed to the elements, is not yet concretely confirmed.
Safe,Save,safe,save	Safe	save	Save	Resources for the [MASK] Sleeping Village on 1515 South Van Ness Ave., a site for homeless tents that is partly covered and partly exposed to the elements, is not yet concretely confirmed.
Safe,Save,safe,save	Safe	Save	Save	Road RAPTER or Radiological Assistance Program Training for Emergency Response, was spearheaded by Luke AFB’s EOD unit, the Phoenix Regional Render [MASK] Team, and the Radiological Assistance Program.
Safe,Save,safe,save	Safe	save	Save	Road RAPTER or Radiological Assistance Program Training for Emergency Response, was spearheaded by Luke AFB’s EOD unit, the Phoenix Regional Render [MASK] Team, and the Radiological Assistance Program.
Safe,Save,safe,save	Safe	Save	Save	Roxham Rd. is a popular unofficial crossing point for people who want to avoid being subject to the [MASK] Third Country Agreement, which obliges asylum seekers to send their application to the first “safe” country they reach.
Safe,Save,safe,save	Safe	Save	Save	[MASK], Happy Holidays to all!
Safe,Save,safe,save	Save	Safe	Safe	Abdul Shakeel, with the activist group Basti Suraksha Manch, or [MASK] Colony Forum, says that “in the name of beautification, the urban poor’s lives are destroyed.”
Safe,Save,safe,save	Save	Safe	Safe	A campaign group called ‘[MASK] McClymont’ has been set up, and the group has said that it is disappointed in communication on decisions.
Safe,Save,safe,save	Save	Safe	safe	According to the ‘Watt a [MASK]’ report from the Home Builders Federation, on average, buyers of new homes save over £2000 on household bills per household each year, equivalent to £173 a month.
Safe,Save,safe,save	Save	safe	safe	According to the ‘Watt a [MASK]’ report from the Home Builders Federation, on average, buyers of new homes save over £2000 on household bills per household each year, equivalent to £173 a month.
Safe,Save,safe,save	Save	Safe	Safe	Alternatively, you can tap the Share button in iMovie on your Macbook and select Options > Project > [MASK] to Files.
Safe,Save,safe,save	Save	Safe	Safe	An organisation made ‘[MASK] Culture Save India Foundation’ issued a statement stating that the scene had hurt the religious sentiments of Hindus.
Safe,Save,safe,save	Save	safe	safe	An organisation made ‘[MASK] Culture Save India Foundation’ issued a statement stating that the scene had hurt the religious sentiments of Hindus.
Safe,Save,safe,save	Save	Safe	Safe	An organisation made ‘[MASK] Culture Save India Foundation’ issued a statement stating that the scene had hurt the religious sentiments of Hindus.
Safe,Save,safe,save	Save	safe	safe	An organisation made ‘[MASK] Culture Save India Foundation’ issued a statement stating that the scene had hurt the religious sentiments of Hindus.
Safe,Save,safe,save	Save	Safe	Safe	Another sign struck a more diplomatic tone: “[MASK] Little Tokyo.”
Safe,Save,safe,save	Save	Safe	Safe	At Perimeter, we characterize the solutions we develop as ‘Trusted Solutions that [MASK]’ – because it underscores what we are trying to accomplish for our customers and the world at large.
Safe,Save,safe,save	Save	safe	safe	At Perimeter, we characterize the solutions we develop as ‘Trusted Solutions that [MASK]’ – because it underscores what we are trying to accomplish for our customers and the world at large.
Safe,Save,safe,save	Save	Safe	Safe	At the material time that he was involved in the four protests he was an organizer and coordinator with the [MASK] Old Growth movement.
Safe,Save,safe,save	Save	safe	safe	A window will appear asking you where to save the file; choose a location and click “[MASK]”. iTunes will begin downloading.
Safe,Save,safe,save	Save	Safe	Safe	Conversely, with Democrats still holding the Senate and White House, McCarthy's push for massive spending cuts as outlined in his Limit [MASK] Grow Bill are virtually non-starters even if he's able to wrangle his own caucus.
Safe,Save,safe,save	Save	Safe	Safe	During the launch event, YES WORLD CEO and [MASK] Earth Activist Dr. Sandeep Choudhary said that the results of the Windows solution by YES WORLD have been amazing.
Safe,Save,safe,save	Save	Safe	Safe	ECOBANK Nigeria has rewarded 50 of its customers in the first draw of its “[MASK] and Score” promo.
Safe,Save,safe,save	Save	safe	Safe	ECOBANK Nigeria has rewarded 50 of its customers in the first draw of its “[MASK] and Score” promo.
Safe,Save,safe,save	Save	Safe	Safe	Failed Republican gubernatorial nominee Kari Lake is set to host a "[MASK] Arizona Rally" ahead of a crunch court date to reconsider her claims that the 2022 election was beset by voter fraud.
Safe,Save,safe,save	Save	safe	Safe	Failed Republican gubernatorial nominee Kari Lake is set to host a "[MASK] Arizona Rally" ahead of a crunch court date to reconsider her claims that the 2022 election was beset by voter fraud.
Safe,Save,safe,save	Save	Safe	Safe	FILE - Alex Jones, left, attends a rally in support of President Donald Trump called the "[MASK] America Rally," on Jan.
Safe,Save,safe,save	Save	Safe	Safe	Former Nationals MP George Christensen fronting the Citizen Go [MASK] Free Speech campaign in Canberra.
Safe,Save,safe,save	Save	safe	safe	Former Nationals MP George Christensen fronting the Citizen Go [MASK] Free Speech campaign in Canberra.
Safe,Save,safe,save	Save	Safe	Safe	For what should be clear reasons, desktop users will not see the Battery [MASK] option.
Safe,Save,safe,save	Save	Safe	Safe	Gain a +1 bonus to Attack rolls, damage, and Spell [MASK] DC for every foe slain, up to a maximum of +3.
Safe,Save,safe,save	Save	Safe	Safe	He is suing Lake, her campaign and the nonprofit [MASK] Arizona Fund Inc., over allegations that Lake blamed him for her narrow election loss to Democratic Gov. Katie Hobbs in 2022.
Safe,Save,safe,save	Save	Safe	Safe	In June 2021, the vendor company banned Green [MASK] Energy and ECO from participating in their program, and Cleggett was banned from participating in Mass Save altogether, the release said.
