confusion_set	expected	target	suggestion	masked_sentence
Country,County,country,county	county	country	country	An NCIC spokesman said: "Thankfully these incidents are rare in our [MASK].
Country,County,country,county	county	Country	Country	Anyone in doubt about the impact Derry's back to back Ulster champions are having on the Oak Leaf [MASK] need only have tried get two minutes' peace in Brendan Rogers' house during the build up to Sunday!
Country,County,country,county	county	country	country	Anyone in doubt about the impact Derry's back to back Ulster champions are having on the Oak Leaf [MASK] need only have tried get two minutes' peace in Brendan Rogers' house during the build up to Sunday!
crab,crap	crab	crap	crap	“And we have found that, especially (in) Dungeness [MASK],” Wright said.
crab,crap	crab	crap	crap	Back inside, Oku tries for the frog splash once more, instead landing a froggy crossbody for a near-fall, as it was then time to go for the half [MASK].
crab,crap	crab	crap	crap	Blind date: ‘I will for ever be the woman who denied him a [MASK] bisque’
crab,crap	crab	crap	crap	But the [MASK] race, now that was my jam.
crab,crap	crab	crap	crap	He might’ve left a few minutes later with John Jensen to pick up some [MASK] the Petersens had caught earlier that day down at the Water Trough.
crab,crap	crab	crap	crap	He said the low [MASK] price didn’t factor into his decision to participate this year.
crab,crap	crab	crap	crap	Plus, there is also a mini [MASK] cart that comes out, so depending on your reservation time, you may need to strategize this into your buffet experience as well.
crab,crap	crab	crap	crap	Recent data shows that the cryptocurrency has been recording “[MASK]-like” price action in the short term, but operators favor the long side of their trades.
crab,crap	crab	crap	crap	She survived a half [MASK] but fell to an Argentine Backbreaker Slam in 10:46.
crab,crap	crab	crap	crap	"Should prices normalize, we expect that purchases of Canadian [MASK] will increase."
crab,crap	crab	crap	crap	Sitting down in a half-[MASK] after some business in the corner, break free, whip across, Grayson with a mat slam, walking the ropes, LA ducks the elbow drop!
crab,crap	crab	crap	crap	There was a [MASK] dresser in Cromer, tea and chocolate makers in York, celery growers in Ely and a myriad of others in between.
crab,crap	crab	crap	crap	We have barely started, and my taste buds have been restored, and then rebooted again with a piquant Whitby [MASK] with avocado, apple, livened up with calamansi citrus fruit.
crab,crap	crab	crap	crap	With the price of snow [MASK] less than one-third of what it was a year ago, Newfoundland and Labrador's fishermen are rallying on the steps of the provincial legislature Monday morning to demand government action on the province's most lucrative fishery.
crab,crap	crap	crab	crab	Indeed, it was remarkable that Anderson still was talking [MASK] even as he was being held up by teammates, his legs like jelly.
crab,crap	crap	crab	crab	“We ride the [MASK] tsunami at our peril.”
Desert,desert,dessert	Desert	dessert	dessert	ILT20: Hasaranga’s 3/18, Hales’ fifty lead [MASK] Vipers to 7-wicket win.
Desert,desert,dessert	desert	dessert	dessert	Does breakfast come with [MASK]?
Desert,desert,dessert	desert	dessert	dessert	During the Preservation Board Committee meeting on January 27, 2023, Eric Lander rightly pointed out that the neighborhood has been a “retail [MASK]” for decades.
Desert,desert,dessert	desert	dessert	dessert	Even the [MASK] has joined the holiday show.
Desert,desert,dessert	desert	dessert	dessert	Felting and [MASK] basket-making workshops will be run by Aboriginal women.
Desert,desert,dessert	desert	dessert	dessert	He tied for 54th at the Sony Open last week in Honolulu at 6-under, but he was obviously prepared for the ground rules of the [MASK]: Go low or go home.
Desert,desert,dessert	desert	dessert	dessert	Hundreds of thousands of fans descend upon the [MASK] course every year — a record 216,000 in 2018 — to cheer and jeer at decibel levels better suited for a football game.
Desert,desert,dessert	desert	dessert	dessert	I never had the opportunity, but if I was blessed with a heavy bank account, then I would have eaten lamb chops for breakfast, brunch, lunch, dinner, [MASK] and my midnight snack everyday.
Desert,desert,dessert	dessert	Desert	desert	Councillor Dan Hutchison, Scottish Greens, said: “When you walk into this it feels like a [MASK] bar that has put washing powder and toilet roll in there.”
Desert,desert,dessert	dessert	desert	desert	Councillor Dan Hutchison, Scottish Greens, said: “When you walk into this it feels like a [MASK] bar that has put washing powder and toilet roll in there.”
Desert,desert,dessert	dessert	Desert	desert	Former UNLV coach Jeff Horton is reflecting on more than four decades of football after retiring, but many of his ex-players are asking about his wife’s famous [MASK].
Desert,desert,dessert	dessert	desert	desert	Former UNLV coach Jeff Horton is reflecting on more than four decades of football after retiring, but many of his ex-players are asking about his wife’s famous [MASK].
Desert,desert,dessert	dessert	Desert	desert	He’s now back in the building with his own opportunity to scoff Scottish football again while also lapping up the continental [MASK] at the Champions League table.
Desert,desert,dessert	dessert	desert	desert	He’s now back in the building with his own opportunity to scoff Scottish football again while also lapping up the continental [MASK] at the Champions League table.
Desert,desert,dessert	dessert	desert	desert	In years gone by, Hungarian Tokaji was the go to [MASK] wine on British tables.
Desert,desert,dessert	dessert	Desert	desert	It can carry you through to [MASK].
Desert,desert,dessert	dessert	desert	desert	It can carry you through to [MASK].
Desert,desert,dessert	dessert	Desert	desert	It felt like 9 courses because the view is another [MASK].
Desert,desert,dessert	dessert	desert	desert	It felt like 9 courses because the view is another [MASK].
Desert,desert,dessert	dessert	desert	desert	It's going to be a while until JoJo's Bizarre Adventure, so this particular [MASK] is yet to become popular.
Desert,desert,dessert	dessert	desert	desert	Jamie, also from Tranmere, first registered the business when he was just 19-years-old after falling in love with the [MASK] and food industry.
Desert,desert,dessert	dessert	desert	desert	Juul stopped selling its fruit and [MASK]-flavored vaping pods.
Desert,desert,dessert	dessert	desert	desert	Marjorie Taylor Greene sees impeachment votes as her ‘[MASK]’
Desert,desert,dessert	dessert	desert	desert	She called the [MASK] "Crime of Passion."
Desert,desert,dessert	dessert	desert	desert	‘She prized [MASK] above everything else’
Desert,desert,dessert	dessert	Desert	desert	That’s the tactic 52-year-old San Francisco resident Lucia Chang used to knock out her own [MASK] cravings.
Desert,desert,dessert	dessert	desert	desert	That’s the tactic 52-year-old San Francisco resident Lucia Chang used to knock out her own [MASK] cravings.
Desert,desert,dessert	dessert	desert	desert	The brewery has produced more than a dozen weird — yet delicious — beers including a cactus fruit and hibiscus sour, cucumber gin botanical lemon sea salt Kölsch and a speculoos-inspired [MASK] beer.
Desert,desert,dessert	dessert	desert	desert	The latter are often labelled in-store as ‘[MASK]’ peaches and feature soft juicy flesh, either white or yellow, that easily falls away from the pit or stone.
Easy,ease,easy	Easy	ease	ease	In expressing concern and support for the affected candidates and institution, Bennett-[MASK] said: “This is a shameful act and the first incident of its kind for us as a country.
Easy,ease,easy	ease	easy	easy	Andrew Richardson has a lolloping [MASK] as cool Sky, seeming to lounge into luck and song.
Easy,ease,easy	easy	ease	ease	A lot of people don’t directly correlate their behaviours with tackling climate change and when they have [MASK] and better alternatives, they’re happy to make worthwhile adjustments like meat free Mondays.
Effects,affects,effects	affects	effects	effects	According to Dhole, nutrition and fasted low-intensity cardio help maintain low body fat, and intense workouts help build muscle mass which directly [MASK] fat loss in a good way.
Effects,affects,effects	affects	effects	effects	Amal observed that an elevation in nitric oxide levels [MASK] presumably leading to neuronal dysfunction that converges into behavioral deficits.
extend,extent	extend	extent	extent	Acapulco’s nearly one million residents were cut off and unable to communicate with the outside world, leaving the [MASK] of the storm’s damage, including the number of those dead or missing, unknown.
extend,extent	extend	extent	extent	Based on reports received to date, it has been determined to [MASK] investigative works on the site.”
feat,feet	feat	feet	feet	He noted that fortunes of the University would improve tremendously with the new [MASK].
Few,View,few,view	Few	View	View	[MASK] dominated the paint like did with the Orlando Magic.
Few,View,few,view	View	few	few	At this year's show, you will be able to meet multiple stars from various [MASK] Askew productions.
Few,View,few,view	View	Few	few	Click the "[MASK] channels in your area" link on its to see which local channels are offered in your ZIP code.
Few,View,few,view	View	few	few	Click the "[MASK] channels in your area" link on its to see which local channels are offered in your ZIP code.
Few,View,few,view	View	Few	Few	Despite the inherent risks and occasional missteps in venture investing - as seen with WeWork, [MASK], Didi, Getaround, among others - Son's unwavering commitment, tireless work ethic, and capacity to innovate are undeniable.
Few,View,few,view	View	Few	Few	Green [MASK] – Patrick Harvie: ‘Glasgow is vulnerable to more storms on the horizon’
Few,View,few,view	few	view	view	Above are a [MASK] of many large questions that will have effects inside classrooms.
Few,View,few,view	view	Few	few	A community drop-in event is planned for Tuesday, April 25, at Lochinver Village Hall from 3pm-7pm to meet the architects and [MASK] and discuss the initial plans.
Few,View,few,view	view	few	few	A community drop-in event is planned for Tuesday, April 25, at Lochinver Village Hall from 3pm-7pm to meet the architects and [MASK] and discuss the initial plans.
Few,View,few,view	view	few	few	All that is left today of that anxious era is a few support beams - and the [MASK].
Form,From,form,from	Form	From	from	Carolina, [MASK] 8, who played Moana, said: “Being Moana is a gift, it is something I have always wanted to be since I saw the film.
Form,From,form,from	Form	from	from	Carolina, [MASK] 8, who played Moana, said: “Being Moana is a gift, it is something I have always wanted to be since I saw the film.
Form,From,form,from	Form	From	From	Clear [MASK] Instructions: Offering explicit and easy-to-understand instructions and error messages for all users, especially beneficial for those with cognitive disabilities.
Form,From,form,from	Form	from	from	Clear [MASK] Instructions: Offering explicit and easy-to-understand instructions and error messages for all users, especially beneficial for those with cognitive disabilities.
Form,From,form,from	From	Form	form	Eion Bailey couldn’t wait to get back on set for the MGM+ series “[MASK].”
Form,From,form,from	From	form	form	Eion Bailey couldn’t wait to get back on set for the MGM+ series “[MASK].”
Form,From,form,from	From	Form	Form	Federal Road Safety Corps Confirms Three Injuries [MASK].
Form,From,form,from	From	form	Form	Federal Road Safety Corps Confirms Three Injuries [MASK].
Form,From,form,from	form	From	from	A final member of the group, 38-year-old Mark Pettigrew [MASK] west London, was handed a suspended four-month prison sentence, fined £300 and made to pay a £128 victim surcharge.
Form,From,form,from	form	from	from	A final member of the group, 38-year-old Mark Pettigrew [MASK] west London, was handed a suspended four-month prison sentence, fined £300 and made to pay a £128 victim surcharge.
Form,From,form,from	form	from	from	All of those mind-fogging permutations aside, the ask for France is a simple one: win by as many points as you can muster then hope for a [MASK] reversing miracle in Dublin.
Form,From,form,from	form	From	from	Almost every room can benefit [MASK] a sleek sectional, and the ($1,733, originally $2,089) is a sophisticated design that will make your space look elevated.
Form,From,form,from	form	from	from	Almost every room can benefit [MASK] a sleek sectional, and the ($1,733, originally $2,089) is a sophisticated design that will make your space look elevated.
Form,From,form,from	from	form	form	A 27-year-old woman [MASK] has been arrested on suspicion of assisting an offender.
Fourth,forth,fourth	Fourth	forth	forth	[MASK], MoU between the Institute of Foreign Affairs Nepal and Sushma Swaraj Institute of Foreign Services Delhi.
Fourth,forth,fourth	forth	fourth	fourth	But in addition to that, we did announce that we complete our four key 2022 milestones and targets to be at set [MASK].
Fourth,forth,fourth	forth	Fourth	fourth	Capital market operators have said that despite the [MASK] coming election, the nation’s equity market will sustain growth profile within te first few months of the year as investors await the releases of companies audited financial account.
Fourth,forth,fourth	forth	fourth	fourth	Capital market operators have said that despite the [MASK] coming election, the nation’s equity market will sustain growth profile within te first few months of the year as investors await the releases of companies audited financial account.
Fourth,forth,fourth	forth	Fourth	Fourth	Federal Acquisition Policy and Procedure (PAP) 2021-05, Evaluation of FSS Program Pricingsets [MASK] “comprehensive guidance regarding the evaluation of pricing throughout the life of a Federal Supply Schedule (FSS) program contract.”
forms,forums	forms	forums	forums	A community [MASK], and is enhanced by regular potlucks, picnics and celebrations of holidays and birthdays/anniversaries.
forms,forums	forms	forums	forums	Arugungu said the sale of the [MASK] would commence on December 27 and end on January 2, 2024.
forms,forums	forms	forums	forums	Asked this week if he saw the lack of probing questions in House disclosure [MASK] as a problem, Chesnut-Tangerman said, “I understand the concern.
forms,forums	forms	forums	forums	But Schwartz says the humour has worn off after repeated phone calls, online [MASK] and emails to WestJet failed to produced any results.
forms,forums	forums	forms	forms	And if you repeat this over and over here in the [MASK], I'm sure one day the government will listen and release that data, probably under the header 「ブロンコが要求する特別な情報」.
forms,forums	forums	forms	forms	At that point, after being on testosterone for a number of years, she was blocked from online trans [MASK] and prevented from posting and engaging.
forms,forums	forums	forms	forms	Chatroulette, in addition to Omegle, tend to be haphazard [MASK] in which consumers can talk with visitors worldwide.
forms,forums	forums	forms	forms	However, he told that the cases sent back to NAB were shifted to other relevant [MASK].
forms,forums	forums	forms	forms	However, Litman’s research methods (such as only surveying parents from online [MASK] already explicitly concerned with rapid onset gender dysphoria) were immediately questioned by fellow researchers upon publication.
forms,forums	forums	forms	forms	“I find it ironic that all these other [MASK] we keep talking about affordable housing, and everyone wants to build, build, build, build.
forms,forums	forums	forms	forms	“Included in this are interventions that will support community policing, strengthen community policing [MASK] and street committees, protect whistle-blowers, among others.
forms,forums	forums	forms	forms	In [MASK], Almeida hinges his platform on the creation of an online advising hub that will increase access to academic advisors and support.
forms,forums	forums	forms	forms	In line with its pacifist constitution, Japan must abandon its cold-blooded policy and take a strong stand for human rights and equality in all multilateral [MASK] related to the Rohingya tragedy.
forms,forums	forums	forms	forms	In the special courts, tribunals, [MASK] set up for crimes against women and children, only women lawyers should be kept as representatives of the government.
forms,forums	forums	forms	forms	It’s a drama that reveals how internal U.S. politics can spillover into global [MASK].
forms,forums	forums	forms	forms	Journalists who say Chamisa's party doesn't explain corruption to rural folks, do they make sense, when seniors like Biti have led parliamentary & rural [MASK] for 2 decades and Nero's Spokesman's talked about Gold Mafia since 2017?
forms,forums	forums	forms	forms	Mr Woods said the investment had been developed in response to growers in various [MASK], including GRDC’s National Grower Network, highlighting concerns that the risks associated with farming had escalated in the past decade.
forms,forums	forums	forms	forms	Serious competition is expected in sambo which will feature regular winners of major international [MASK], in particular the Mongolian national team," Aleksandr Baraulya said.
forms,forums	forums	forms	forms	Teach students through sexual violence [MASK] and help them understand that people are not objects.
forms,forums	forums	forms	forms	That probably is the reason that these shows look more like entertainment stuff than [MASK] for informative and educative debates.
forms,forums	forums	forms	forms	The NUA has not shown up to any of the [MASK], but they are not first-time offenders.
forms,forums	forums	forms	forms	They also successfully represent their Motherland at most prestigious [MASK] and leading theatrical stages of the world, preserve and augment the cultural heritage of Belarus.
forms,forums	forums	forms	forms	This has been a big subject on Dodge [MASK] for years, owners wondering about the ins and outs of the P1400 code that shows on a scan report signifying an altered PCM.
forms,forums	forums	forms	forms	This is accomplished through a range of [MASK], training, and educational opportunities for all social groups, that assist community members in improving their interpersonal skills, problem-solving abilities, and crisis management.
forms,forums	forums	forms	forms	Who were you listening to, PFT [MASK]?
Found,Fund,found,fund	Found	Fund	Fund	A supposed glitch in the popular “[MASK] My iPhone” app has been directing random strangers to the home of an unsuspecting Texas dad at all hours of the day, falsely accusing him of stealing their electronic devices.
Found,Fund,found,fund	Found	fund	fund	A supposed glitch in the popular “[MASK] My iPhone” app has been directing random strangers to the home of an unsuspecting Texas dad at all hours of the day, falsely accusing him of stealing their electronic devices.
Found,Fund,found,fund	Found	Fund	Fund	As we announced in our last call, we recently acquired Planet [MASK] Energy Development.
Found,Fund,found,fund	Found	Fund	Fund	Evenson's most recent book, "[MASK] Stories of The Old Duck Hunters and Other MacQuarrie Adventures,'' along with the two previous MacQuarrie anthologies he edited, is available through the Barnes Area Historical Association in Barnes, Wis.
Found,Fund,found,fund	Found	Fund	Fund	[MASK] by CNBC Pro Wall Street Research.
Found,Fund,found,fund	Found	Fund	Fund	How One [MASK] Footage Film Fooled a Generation a Decade Before 'The Blair Witch Project'
Found,Fund,found,fund	Found	Fund	Fund	Human Remains [MASK] Near Search Area for Missing Actor Julian Sandsvariety.
Found,Fund,found,fund	Found	fund	Fund	Human Remains [MASK] Near Search Area for Missing Actor Julian Sandsvariety.
Found,Fund,found,fund	Found	Fund	Fund	The network has renewed both of its first-year drama series, [MASK] and The Irrational for second seasons.
Found,Fund,found,fund	Fund	Found	Found	Benefit for the Shivers [MASK] at Pikes Peak Library District.
Found,Fund,found,fund	found	fund	fund	A ballot of Unison members at the publicly owned utility [MASK] almost four fifths (78 per cent) were in favour of strike action.
Found,Fund,found,fund	fund	found	found	A group comprised of Newgame and Bruellan called the offer 'inadequate', arguing it 'significantly undervalues' the company and criticising its exclusion of GAM's [MASK] services arm, which will be offloaded as part of the agreement.
Found,Fund,found,fund	fund	found	found	Among the factors of the transfer, which will be considered by the committee is [MASK] source of the project, as well as building construction and public transportation accessibility of the proposed location in BGC.
Found,Fund,found,fund	fund	Found	found	And how are we going to [MASK] it?
Found,Fund,found,fund	fund	found	found	And how are we going to [MASK] it?
Found,Fund,found,fund	fund	found	found	And, in many states, the will [MASK] arts integration activities in different regions, so they often have activities, lesson plans, and teaching artists to share.
Found,Fund,found,fund	fund	Found	found	And the securitized loans self [MASK] within the securitization.
Found,Fund,found,fund	fund	found	found	And the securitized loans self [MASK] within the securitization.
Found,Fund,found,fund	fund	found	found	And the sooner we understand that, and realize that, and [MASK] the DEA and local and state task forces to go after it, the better off we’ll be.”
Found,Fund,found,fund	fund	found	found	Angie Cole, who operates the swimming pool, said: “We wanted to be a lot more community focussed and the support we received (to [MASK] the defibrillator) has been amazing.
Lead,Led,lead,led	Lead	led	led	Also speaking, the OGSTEP Taskforce Team [MASK] from World Bank, Abel Lufafa, emphasised the need for all stakeholders to work together to ensure the success of OGFIMS, noting that accessing farmers for future development would demand a lot of information.
Lead,Led,lead,led	Lead	Led	Led	Americans [MASK] the Memecoin Craze in 2023 (Study)cryptopotato.
Lead,Led,lead,led	Lead	led	led	Americans [MASK] the Memecoin Craze in 2023 (Study)cryptopotato.
Lead,Led,lead,led	Lead	Led	Led	As flagged on the Instagram account of The [MASK]-Lag Report, even though policy rates have surged from the levels seen in 2021, the relative strength ratio of the tech sector to the S&P500 has held up pretty well.
Lead,Led,lead,led	Lead	led	led	At least seven CARICOM Heads of Government will participate in the symposium which Dr. the Hon. Keith Rowley, Prime Minister of the Republic of Trinidad and Tobago, and [MASK] Head with responsibility for Crime and Security, will chair.
Lead,Led,lead,led	Lead	Led	Led	Help [MASK] Ndigbo Out of Nigeria Now!
Lead,Led,lead,led	Lead	led	led	HSE [MASK] for covid-19 Test and Trace and Vaccination Eileen Whelan said the online booking portal will also close from Thursday.
Lead,Led,lead,led	Lead	Led	Led	“It’s very upsetting that so many dogs have lost their lives because of accidents that could have been prevented by just being able to see the teams better,” said Victoria Stocking, who started Light Up The [MASK] Dogs with her mother, Cherie Lovely.
Lead,Led,lead,led	Lead	led	led	Ken Earle’s team won 19 shots to 14. Graeme Godkin was [MASK].
Lead,Led,lead,led	Lead	Led	Led	[MASK] by example.
Lead,Led,lead,led	Lead	led	led	[MASK] by example.
Lead,Led,lead,led	Lead	Led	Led	[MASK] gen advertisers have access to nearly everything an ecommerce advertiser does, except for shopping inventory, which requires a product feed.
Lead,Led,lead,led	Lead	Led	Led	[MASK] observe each day for Gold Group and help as wanted with assigned teams.
Lead,Led,lead,led	Lead	Led	Led	[MASK] Real Estate Co., Ltd will be offering 1,143,000 shares at a per-share value of $8.
Lead,Led,lead,led	Lead	Led	Led	[MASK] said: "When Margo was treated the vet said she could see Margo’s femoral artery.
Lead,Led,lead,led	Lead	led	led	[MASK] said: "When Margo was treated the vet said she could see Margo’s femoral artery.
Lead,Led,lead,led	Lead	Led	Led	[MASK] the group.
Lead,Led,lead,led	Lead	Led	Led	[MASK] with social engagement: Integrate stakeholders, internal and external.
Lead,Led,lead,led	Lead	Led	Led	Members of The [MASK]-Lag Report get exclusive access to our subscriber-only portfolios.
Lead,Led,lead,led	Lead	led	Led	Members of The [MASK]-Lag Report get exclusive access to our subscriber-only portfolios.
Lead,Led,lead,led	Lead	Led	Led	New Condos and Old Townhouses [MASK] the Pack in February Salesnytimes.
Lead,Led,lead,led	Lead	led	led	New Condos and Old Townhouses [MASK] the Pack in February Salesnytimes.
Lead,Led,lead,led	Lead	Led	Led	Paid subscribers who viewed this week's global section of The [MASK]-Lag Report would note that I've highlighted how European equities are in a better place than their US counterparts.
Lead,Led,lead,led	Lead	Led	Led	Representative Don Bacon (R-NE) said Thursday on CNN’s “The [MASK]” that his Republican colleagues refusing to support Republican leader Kevin McCarthy (R-CA) for Speaker of the House were like terrorists.
Lead,Led,lead,led	Led	Lead	Lead	Developers will be required to engage with an Architect [MASK] Design Team and a Construction Contractor with the necessary skills and experience to design, deliver, and certify high quality social housing in order to make a valid submission.
Lead,Led,lead,led	Led	lead	Lead	Developers will be required to engage with an Architect [MASK] Design Team and a Construction Contractor with the necessary skills and experience to design, deliver, and certify high quality social housing in order to make a valid submission.
Lead,Led,lead,led	Led	Lead	Lead	Even Thought It Never Aired, Bruce Wayne [MASK] Directly to the Creation of 'Smallville'
