confusion_set	expected	target	suggestion	masked_sentence
To,Too,Two,to,too,two	Too	To	to	Non-Injury Motor Vehicle Accident/Following [MASK] Closely: North Berthoud Parkway/Bunyan Avenue — A vehicle was turning onto Bunyan Avenue from North Berthoud Parkway and was struck by the vehicle following behind.
To,Too,Two,to,too,two	Too	to	to	Non-Injury Motor Vehicle Accident/Following [MASK] Closely: North Berthoud Parkway/Bunyan Avenue — A vehicle was turning onto Bunyan Avenue from North Berthoud Parkway and was struck by the vehicle following behind.
To,Too,Two,to,too,two	Too	to	to	“Penal Cordillera” was produced by director-producers (“[MASK] Late to Die Young”) and Omar Zuñiga (“The Strong Ones”) of Cinestación, in co-production with Multiverso, Brazil.
To,Too,Two,to,too,two	Too	to	to	Since its founding and the ground-breaking social media in 2017, Burke and contributors of Me [MASK] have expanded the organization’s programming and reached millions.
To,Too,Two,to,too,two	Too	To	To	Smoker was named to SwimSwam’s “Best of the Rest” breaststroke part of the Way [MASK] Early checklist of prime recruits within the class of 2024.
To,Too,Two,to,too,two	Too	to	to	Smoker was named to SwimSwam’s “Best of the Rest” breaststroke part of the Way [MASK] Early checklist of prime recruits within the class of 2024.
To,Too,Two,to,too,two	Too	to	to	The ex-vice president and 2024 candidate has begun selling merchandise that says “[MASK] honest” – something Mr Trump allegedly told Mr Pence after he refused to engage in a scheme to unlawfully decertify election results.
To,Too,Two,to,too,two	Too	Two	Two	The other seven-figure yearling engaged on Monday is Invincible Madison, a $1.2m I Am Invincible-Super [MASK] filly who was bought by American interests at Magic Millions.
To,Too,Two,to,too,two	Too	two	two	The other seven-figure yearling engaged on Monday is Invincible Madison, a $1.2m I Am Invincible-Super [MASK] filly who was bought by American interests at Magic Millions.
To,Too,Two,to,too,two	Too	Two	Two	“They couldn’t have been nicer and were incredibly complimentary about King’s Lynn, they even enjoyed a bottle of Festival [MASK] gin from our neighbours at WhataHoot.
To,Too,Two,to,too,two	Too	to	to	“They couldn’t have been nicer and were incredibly complimentary about King’s Lynn, they even enjoyed a bottle of Festival [MASK] gin from our neighbours at WhataHoot.
To,Too,Two,to,too,two	Too	two	two	“They couldn’t have been nicer and were incredibly complimentary about King’s Lynn, they even enjoyed a bottle of Festival [MASK] gin from our neighbours at WhataHoot.
To,Too,Two,to,too,two	Too	Two	two	This team appears very talented on paper, but as Jerry Reinsdorf lamented in an email response, “[MASK] bad games are not played on paper.”
To,Too,Two,to,too,two	Too	two	two	This team appears very talented on paper, but as Jerry Reinsdorf lamented in an email response, “[MASK] bad games are not played on paper.”
To,Too,Two,to,too,two	Too	to	to	‘[MASK] many clubs that I’ve seen may have short-term success, but it will be short-term because there’s no other result people focus on than the match result.’
To,Too,Two,to,too,two	Two	To	to	ACCIDENT WITH INJURY—[MASK] vehicle crash at Center Street/U.
To,Too,Two,to,too,two	Two	to	to	ACCIDENT WITH INJURY—[MASK] vehicle crash at Center Street/U.
To,Too,Two,to,too,two	Two	To	to	Action from the Welsh [MASK] Day Enduro.
To,Too,Two,to,too,two	Two	to	to	Action from the Welsh [MASK] Day Enduro.
To,Too,Two,to,too,two	Two	Too	Too	A minimum of 1,500 m of drilling is planned for the Lithium [MASK] property with the option to add additional drill hole based on results.
To,Too,Two,to,too,two	Two	to	to	A minimum of 1,500 m of drilling is planned for the Lithium [MASK] property with the option to add additional drill hole based on results.
To,Too,Two,to,too,two	Two	to	to	A MUM-OF-TWO who started her business on TikTok amassing 71,000 followers, has now launched her own sweet shop in the former [MASK] Brothers store.
To,Too,Two,to,too,two	Two	To	To	Anantara [MASK] Bedroom Beach Pool Villa is spacious, sumptuous and boasts an unrivalled beachfront position.
To,Too,Two,to,too,two	Two	to	to	Anantara [MASK] Bedroom Beach Pool Villa is spacious, sumptuous and boasts an unrivalled beachfront position.
To,Too,Two,to,too,two	Two	to	to	BACOLOD CITY — [MASK] planters federations joined the call for a lesser volume of sugar importation than the 450,000 metric tons (MT) proposed by the Sugar Regulatory Administration (SRA) for a two-month buffer stock.
To,Too,Two,to,too,two	Two	To	to	Binhi at Ani Filipino Community Center Hosts [MASK]…
To,Too,Two,to,too,two	Two	to	to	Binhi at Ani Filipino Community Center Hosts [MASK]…
To,Too,Two,to,too,two	Two	To	to	Bringing you guys a video breaking down my thoughts on an exciting Day [MASK] Pittsburgh Steelers’ draft.
To,Too,Two,to,too,two	Two	to	to	Bringing you guys a video breaking down my thoughts on an exciting Day [MASK] Pittsburgh Steelers’ draft.
To,Too,Two,to,too,two	Two	To	to	But in an article headlined “Biden Could Lose First [MASK] ’24 Contests to RFK Jr.,” Axios reported, “If Biden isn’t on the ballot, some Democrats have floated a write-in campaign in Iowa and New Hampshire.”
To,Too,Two,to,too,two	Two	to	to	But in an article headlined “Biden Could Lose First [MASK] ’24 Contests to RFK Jr.,” Axios reported, “If Biden isn’t on the ballot, some Democrats have floated a write-in campaign in Iowa and New Hampshire.”
To,Too,Two,to,too,two	Two	Too	Too	But it wasn’t clear out of the gate that [MASK] Phil’s would end up being considered a top-third contender in the Derby field.
To,Too,Two,to,too,two	Two	to	to	But it wasn’t clear out of the gate that [MASK] Phil’s would end up being considered a top-third contender in the Derby field.
To,Too,Two,to,too,two	Two	too	too	But it wasn’t clear out of the gate that [MASK] Phil’s would end up being considered a top-third contender in the Derby field.
To,Too,Two,to,too,two	Two	To	To	“But this Account [MASK] support facility is not collateral.
To,Too,Two,to,too,two	Two	to	to	“But this Account [MASK] support facility is not collateral.
To,Too,Two,to,too,two	Two	To	to	Courtesy / Boston Police Department [MASK] photos of Reina Carolina Morales Rojas, 41, who disappeared on Nov. 26, 2022.
To,Too,Two,to,too,two	Two	to	to	Courtesy / Boston Police Department [MASK] photos of Reina Carolina Morales Rojas, 41, who disappeared on Nov. 26, 2022.
To,Too,Two,to,too,two	Two	To	to	Daggers, who stay eighth in Dorset & Wilts [MASK] South, next entertain North Dorset Seconds in the cup on Saturday (2pm).
To,Too,Two,to,too,two	Two	to	to	Daggers, who stay eighth in Dorset & Wilts [MASK] South, next entertain North Dorset Seconds in the cup on Saturday (2pm).
To,Too,Two,to,too,two	Two	to	to	Depending on the Super [MASK] service time cutoff, the Orioles will have 14 to 17 players who are eligible for arbitration.
To,Too,Two,to,too,two	to	too	too	$1.765 billion Powerball jackpot goes [MASK] lucky…
To,Too,Two,to,too,two	too	to	to	£19.95 used to get you AJ/Klitschko, Brook/Golovkin, Froch/Groves - with cracking undercards [MASK].
To,Too,Two,to,too,two	too	to	to	A 720p HD webcam is useful for taking video calls [MASK].
To,Too,Two,to,too,two	too	To	to	A backlit keyboard with an integrated numeric keypad is useful for achieving the gaming aesthetic for less [MASK].
To,Too,Two,to,too,two	too	to	to	A backlit keyboard with an integrated numeric keypad is useful for achieving the gaming aesthetic for less [MASK].
To,Too,Two,to,too,two	too	two	two	A backlit keyboard with an integrated numeric keypad is useful for achieving the gaming aesthetic for less [MASK].
To,Too,Two,to,too,two	too	To	to	Accessible boarding areas are coming [MASK] and the platform edges will be reconstructed to serve the northbound and southbound 4 and 5 trains.
To,Too,Two,to,too,two	too	to	to	Accessible boarding areas are coming [MASK] and the platform edges will be reconstructed to serve the northbound and southbound 4 and 5 trains.
To,Too,Two,to,too,two	too	to	to	According to the police, Guddi [MASK], when brought to Cooper hospital on Tuesday, initially told the police in her statement that while she was cooking food at her home in Sai Dham Wadi, Jogeshwari (East), the stove exploded and trapped her in a blaze.
To,Too,Two,to,too,two	too	To	to	“A central theme of politics nowadays — and we’ve certainly seen this with the Biden campaign [MASK] — is influencer marketing,” he said.
To,Too,Two,to,too,two	too	to	to	“A central theme of politics nowadays — and we’ve certainly seen this with the Biden campaign [MASK] — is influencer marketing,” he said.
To,Too,Two,to,too,two	too	To	to	A cider maker says a complaint about his product being ‘[MASK] sexual’ is ‘utterly disgraceful.’
To,Too,Two,to,too,two	too	to	to	A cider maker says a complaint about his product being ‘[MASK] sexual’ is ‘utterly disgraceful.’
To,Too,Two,to,too,two	too	to	to	Addressed Professor Weasley falling out of the world as avatar wonders away [MASK] far.
To,Too,Two,to,too,two	too	to	to	Adelman said the self-defense and immunity arguments came [MASK] late in the process.
To,Too,Two,to,too,two	too	Two	two	Adventure dogs are a special breed, and if you share your life with one, I hope you [MASK] can reap the lessons and wisdom they subtly and willingly share with us.
To,Too,Two,to,too,two	too	two	two	Adventure dogs are a special breed, and if you share your life with one, I hope you [MASK] can reap the lessons and wisdom they subtly and willingly share with us.
To,Too,Two,to,too,two	too	To	to	A dynamic or variable refresh rate (VRR) tunes the picture to be smooth with fast framerates, and there’s a dedicated game mode [MASK] when you’re playing on next-gen consoles.
To,Too,Two,to,too,two	too	to	to	A dynamic or variable refresh rate (VRR) tunes the picture to be smooth with fast framerates, and there’s a dedicated game mode [MASK] when you’re playing on next-gen consoles.
To,Too,Two,to,too,two	too	to	to	A few organisations had even approached Rajya Sabha member and environmentalist Balbir Singh Seechewal, but his response [MASK] was lukewarm.
To,Too,Two,to,too,two	two	to	to	$370 fine on-the-spot and [MASK] demerit points or up to $1,849 in court.
To,Too,Two,to,too,two	two	to	to	A "beautiful" mum-of-[MASK] died the day after her wedding.
To,Too,Two,to,too,two	two	to	to	“A bird in the hand is worth [MASK] in the bush.”
Week,weak,week	Week	weak	weak	Below, we're keeping a running list of the very best Walmart+ [MASK] deals we truly recommend.
Week,weak,week	weak	Week	week	Based on management commentary on the recent Earnings Call, it appears that AAPL is bracing for a deceleration in sales and [MASK] earnings for FY2023, compared to FY2022.
Week,weak,week	weak	week	week	Based on management commentary on the recent Earnings Call, it appears that AAPL is bracing for a deceleration in sales and [MASK] earnings for FY2023, compared to FY2022.
Week,weak,week	weak	Week	week	Based on the performance of management and the [MASK] forward forecasts I am not sure funds will be buying this.
Week,weak,week	weak	week	week	Based on the performance of management and the [MASK] forward forecasts I am not sure funds will be buying this.
Week,weak,week	weak	week	week	But I'm just curious, is that just 4Q pickup, which more than offsets maybe the holiday impact, which it didn't have because of a [MASK] July-August or weaker -- softer July-August and 3Q?
Week,weak,week	weak	Week	week	But, what could cause me to change my view is how much delivery systems are being sold to international providers as the [MASK] 1Q23 might be due to international providers delaying their purchase as they await the new launch in 2Q23.
Week,weak,week	weak	week	week	But, what could cause me to change my view is how much delivery systems are being sold to international providers as the [MASK] 1Q23 might be due to international providers delaying their purchase as they await the new launch in 2Q23.
Week,weak,week	weak	week	week	‘China’s Hawaii’ fails post-pandemic test with [MASK] Labour Day retail salesscmp.
Week,weak,week	week	weak	weak	"About as good as it gets for him," Leafs defenceman Morgan Rielly, who had a goal and two assists Sunday, said of his teammate's [MASK].
Weather,Whether,weather,whether	Weather	Whether	whether	As Dionne Warwick became the first celebrity to be unmasked as [MASK], fans are convinced that they know who's beneath Dippy Egg's costume.
Weather,Whether,weather,whether	Weather	whether	whether	As Dionne Warwick became the first celebrity to be unmasked as [MASK], fans are convinced that they know who's beneath Dippy Egg's costume.
Weather,Whether,weather,whether	Whether	Weather	Weather	[MASK] as 's Vault Dweller, players will use a diverse selection of weapons, magic, and more to battle increasingly nightmarish enemies.
Weather,Whether,weather,whether	weather	Whether	whether	'Alarming' [MASK] 'threatening entire planet'
Weather,Whether,weather,whether	weather	whether	whether	'Alarming' [MASK] 'threatening entire planet'
Weather,Whether,weather,whether	weather	whether	whether	A message from him to Tyndall leaked from the Chinese imperial archives shows him directing Tyndall to concoct a false theory about [MASK] — but to be sure to “make it sound science-y.”
Weather,Whether,weather,whether	weather	Whether	whether	And talking ’bout dry, dis [MASK] drier than Vee Pee sense of humor.
Weather,Whether,weather,whether	weather	whether	whether	And talking ’bout dry, dis [MASK] drier than Vee Pee sense of humor.
Weather,Whether,weather,whether	whether	weather	weather	After all, every Boholano [MASK] from Sevilla or Balilihan deserves to partake of nature’s gift of clean water.
Weather,Whether,weather,whether	whether	weather	weather	After restaurant critic [MASK] she will earn her full fee.
weed,wheat	weed	wheat	wheat	About 20 minutes after he went into the dispensary, the long line outside of the store started to move as people were let in in small groups to meet Iverson and purchase [MASK].
weed,wheat	weed	wheat	wheat	A layer of mulch over the bed after planting will help reduce the germination of the [MASK] seeds exposed by digging.
weed,wheat	weed	wheat	wheat	Another brand of [MASK] wrench is called the “Pullerbear.”
weed,wheat	weed	wheat	wheat	As you can read below the big money does not benefit the Oregon communities who are overrun by [MASK] shops.
weed,wheat	weed	wheat	wheat	Barton, who has a BSc honours degree in Land Based Enterprise, also revealed how to remove the pesky [MASK].
weed,wheat	weed	wheat	wheat	But in reality, I got much more than a T-shirt, because I’ve learned a lot about cannabis real estate investing and the rapid evolution of the real estate investment trusts, or REITs, that own [MASK]-based properties.
weed,wheat	weed	wheat	wheat	But Michael Munroe Jr. never showed up for questioning at the community hearing or the zoning board meeting on the proposed [MASK] shop, as required by the board’s own rules.
weed,wheat	weed	wheat	wheat	But THC isn't the end-all-be-all of what makes good [MASK].
weed,wheat	weed	wheat	wheat	But what makes seedless [MASK] so special?
weed,wheat	weed	wheat	wheat	Contact with any part of the non-native [MASK] followed by exposure to UV light from the sun can cause severed discomfort and skin blistering.
weed,wheat	weed	wheat	wheat	Dale is a pot-smoking process server while Saul is his [MASK] dealer.
weed,wheat	weed	wheat	wheat	Dandelions are a type of [MASK] known as a broadleaf perennial, and they are known for being hard to get rid of if not addressed quickly.
weed,wheat	weed	wheat	wheat	Estes Land Stewardship Association (ELSA) volunteers will be on hand to answer [MASK] questions at-a-distance and direct traffic flow.
weed,wheat	weed	wheat	wheat	Green Thumb Industries): Green Thumb Industries is among the best-run [MASK] companies.
weed,wheat	weed	wheat	wheat	Here, you’ll learn all the factors you must consider when shopping for a [MASK] storage container.
weed,wheat	weed	wheat	wheat	He told around the time of the launch that, 'If you know anything about me at all, I'm going to assume it's that I really love [MASK].'
weed,wheat	weed	wheat	wheat	Horny goat [MASK], maca root, and tribulus terrestris are just a few of the all-natural components in this specifically created supplement that have been clinically proven to increase libido and sexual performance in females.
weed,wheat	weed	wheat	wheat	Housing Works opened New York state's first [MASK] dispensary in Manhattan on Dec. 29. An expert predicts more cannabis businesses will follow suit in the coming weeks.
weed,wheat	weed	wheat	wheat	However, he said other by-products of the [MASK] such as hemp clothing and cannabidiol were also a part of their campaign push leading up to the election.
weed,wheat	weed	wheat	wheat	I find it particularly ironic that latter-day progressives in Massachusetts, California, and other blue states were among the first to push for legalization, given that their Progressive forefathers were also the first to criminalize [MASK].
weed,wheat	weed	wheat	wheat	If you are new to consuming [MASK], you can start with a lower dose as you may have lower tolerance levels than those who do.
weed,wheat	weed	wheat	wheat	In some past years, the town has teamed up with the M.D. to share the services of its [MASK] inspector, but this does not appear to be an option anymore.
weed,wheat	weed	wheat	wheat	Instead, opt to ingest [MASK] in other forms that don’t pass through your lungs.
weed,wheat	weed	wheat	wheat	In ten municipalities, it was examined whether coffee shops could be supplied with controlled [MASK] and what the implications would be for public order, crime and public health.
weed,wheat	weed	wheat	wheat	“I think it will stay the [MASK] court for the tournament,” he said Thursday.
weed,wheat	weed	wheat	wheat	McGregor said the same issues had been seen in New York, where there was a “fuzziness” around what was legally being sold and what was not – leading to a cultivation boom that produced a billion-dollar “[MASK] mountain”
weed,wheat	weed	wheat	wheat	Moe Kumre, manager of Santa Clara County [MASK] abatemen program.
weed,wheat	weed	wheat	wheat	Most [MASK] seeds need light to sprout.
weed,wheat	weed	wheat	wheat	Ms Dowling said that tree pollen, grass pollen, [MASK] pollen – which all emerge at different points in the year – could trigger a bout of hay fever.
weed,wheat	weed	wheat	wheat	New York state’s growers have too much [MASK].
weed,wheat	weed	wheat	wheat	No, this isn't a little digital scale for your [MASK] (and please, don't use it for that).
weed,wheat	weed	wheat	wheat	Not just cause they’d have an exceptional [MASK] connect or Skechers plug, but because the man seems to be the kind of person to look out for his homies on an emotional level, and those type of people don’t grow on trees.
weed,wheat	weed	wheat	wheat	Out came the [MASK].'
weed,wheat	wheat	weed	weed	About a dozen students spread out across a classroom, working with [MASK] paste and a special type of adhesive to measure and shape materials.
weed,wheat	wheat	weed	weed	And we have corn, which was basically a fancy [MASK], and we actually did manage to increase it's size by 1000 fold.
weed,wheat	wheat	weed	weed	Besides, the government has gone further to introduce [MASK] to new areas that had not been familiar with its cultivation like in Afar region in the Awash Valley.
weed,wheat	wheat	weed	weed	“Can you tell me if there’s any [MASK] in the gravy, my mother is a coeliac,” my mother would say.
weed,wheat	wheat	weed	weed	He anticipates that the farmers will cover the remaining area in the coming week’s time, given the remaining 7% of paddy harvesting and farmers’ commitment to [MASK] sowing.
weed,wheat	wheat	weed	weed	He retired at the end of March after working for over 30 years at the Agriculture and Agri-Food Canada (AAFC) Swift Current Research and Development Centre on the forefront of applying plant genetics to [MASK] breeding.
weed,wheat	wheat	weed	weed	If you’ve ever eaten tabbouleh, then you’ve eaten bulgur [MASK], even if you didn’t know it.
weed,wheat	wheat	weed	weed	I have shredded [MASK] and skimmed milk for breakfast, and I eat a lot of fruit like bananas and grapes.
weed,wheat	wheat	weed	weed	In a matter like this, everyone is a suspect until the [MASK] is separated from the chaff.
weed,wheat	wheat	weed	weed	It definitely separates the [MASK] from the chaff, but it's likely this savage gameplay that keeps some fans coming back for more.
weed,wheat	wheat	weed	weed	Key standout stars include strengthening castor oil, hair elasticity-enhancing [MASK] germ oil and powerful antioxidant Q10 to help hair growth and strength.
weed,wheat	wheat	weed	weed	Straight Line of the Day: An example of separating the [MASK] from the chaff: …
weed,wheat	wheat	weed	weed	That’s because there was a [MASK] shortage.
weed,wheat	wheat	weed	weed	The one that gets the best [MASK] will gain the King title and wear the hat she made.
weed,wheat	wheat	weed	weed	"The prosecutor Mr. [MASK] looked at me singing Wipe Me Down and shook his head with a look of evil in his eyes," the Baton Rogue native continued, before alleging, "This is total misconduct from a prosecutor.
Were,Where,were,where	Were	Where	Where	A clever refurbishment of the office has doubled capacity so Mr [MASK] is looking to boost the number of local crisis supporters.
Were,Where,were,where	Were	where	where	A clever refurbishment of the office has doubled capacity so Mr [MASK] is looking to boost the number of local crisis supporters.
Were,Where,were,where	Were	where	where	Follow up on the massacre at kibbutz Kfar Aza ([MASK] 40 babies killed there?
Were,Where,were,where	Were	Where	Where	Is THIS Why Prince Harry & Meghan Markle [MASK]n't Invited To Honor Queen Elizabeth's Death With Rest Of Royal Family?
Were,Where,were,where	Were	Where	Where	The Dangers She Faced [MASK] 'Common'
