confusion_set	expected	target	suggestion	masked_sentence
Except,accept,except	Except	accept	accept	[MASK] that these much-too-powerful actors have upset Israeli democracy by usurping powers to themselves never intended by Israel’s founders or parliamentarians; powers which extend far beyond those held by the legal system in any other democracy.
Except,accept,except	Except	accept	accept	“[MASK] to the Giants,” added Martinez, a reference to both Brady’s two Super Bowl losses to the New York Giants and the San Francisco Giants of MLB.
advice,advise	advise	advice	advice	A council spokeswoman previously told Kent Online that they “[MASK] residents can only return to their buildings once the dangerous building has been made safe”.
advice,advise	advise	advice	advice	Again, Coates and the BBB both [MASK] people research and then research again.
advice,advise	advise	advice	advice	As a noobie to gold stocks, what [MASK] would you give on: (1) Should I increase gold stocks to more than 5% of my portfolio?
advice,advise	advise	advice	advice	A spokesperson for Somerset County Highways [MASK] contact the authority.
advice,advise	advise	advice	advice	Be mindful that bad [MASK] from a friend or relative could harm you.
advice,advise	advise	advice	advice	Broker Regina Capital Development Corp. gave a trade the range [MASK] on the stock of SM Investments Corp. (SMIC) after its shares rose over the past trading sessions, and are now consolidating at higher levels.
advice,advise	advise	advice	advice	Chris Zumani, no one asked you for yowa opinion or [MASK].
advice,advise	advise	advice	advice	Digital Thumbs Up combines visual and audible signals to let machine drivers/operators [MASK] other personnel wishing to approach their machines know when it is safe to do so.
advice,advise	advise	advice	advice	If anyone comes across a damaged or fallen power line, the [MASK] is to call them on 687687.
advice,advise	advise	advice	advice	If someone really wants to [MASK] me, I think everyone has my number.
advice,advise	advise	advice	advice	“I have been a member of somebody’s team before in 2014 and 31st August came and I did [MASK] that I think where we are it might be prudent to pull out.
advice,advise	advise	advice	advice	Its spokesperson said under proposed changes staff would be moved on to concourses to help and [MASK] more customers.
advice,advise	advise	advice	advice	MOG said he’ll not take career [MASK] from such a failure who has now expertise in music or production.
Effect,affect,effect	Effect	affect	affect	In case I've piqued your curiosity, enclosed below is the list of my 29 well curated January [MASK] 2023 stocks.
Effect,affect,effect	Effect	affect	affect	Infernal Breath: increased Area of [MASK].
Effect,affect,effect	affect	Effect	effect	A citizenry that knows its rights and appreciates its power to [MASK] change through mobilisation and organisation stands a better chance of holding those in power accountable.
Effect,affect,effect	affect	effect	effect	A citizenry that knows its rights and appreciates its power to [MASK] change through mobilisation and organisation stands a better chance of holding those in power accountable.
Effect,affect,effect	affect	Effect	effect	And, in fact, the entire stunt had zero [MASK] on immigration, or actually the rest.
Effect,affect,effect	affect	effect	effect	And, in fact, the entire stunt had zero [MASK] on immigration, or actually the rest.
Effect,affect,effect	affect	effect	effect	Anger, hurt, resentment, lack of trust, or a sense of being unappreciated can all [MASK] intimacy.
Effect,affect,effect	affect	Effect	effect	"Anti-social behaviour can have a detrimental [MASK] on individuals and communities, if you are victim or witnesses to this behaviour please report to us so we can target our resources accordingly."
Effect,affect,effect	affect	effect	effect	"Anti-social behaviour can have a detrimental [MASK] on individuals and communities, if you are victim or witnesses to this behaviour please report to us so we can target our resources accordingly."
Effect,affect,effect	affect	effect	effect	As a small and new NATO member, Finland will be just as impotent as it was in Afghanistan to [MASK] the momentum of the NATO war machine's rising conflict with Russia.
Effect,affect,effect	affect	effect	effect	As Earth enters this new phase, experts have been discussing how these solar storms could [MASK] modern advancements on the planet and even lead to what a team from George Mason University called an “internet apocalypse.”
Effect,affect,effect	affect	Effect	effect	At the time, newly-elected Mayor Gavin Buckley changed course and wanted to [MASK] a land swap for the Spa Road site with a residential developer.
Effect,affect,effect	affect	effect	effect	At the time, newly-elected Mayor Gavin Buckley changed course and wanted to [MASK] a land swap for the Spa Road site with a residential developer.
Effect,affect,effect	affect	Effect	Effect	At this point, the room can cause extra fire damage to [MASK] players.
Effect,affect,effect	affect	effect	effect	At this point, the room can cause extra fire damage to [MASK] players.
Effect,affect,effect	affect	effect	effect	A vote of ‘Yes’ will allow our people to finally have a seat at the table to provide feedback on policies that [MASK] ‘us’.
Effect,affect,effect	effect	affect	affect	Additionally, when she is ascended, her trace ability can help allies increase their [MASK] hit rate by 10%.
Effect,affect,effect	effect	affect	affect	A diplomat at Qatar’s EU mission told Doha News at the time that the decision “will negatively [MASK] regional and global security cooperation, as well as ongoing discussions around global energy poverty and security.”
Effect,affect,effect	effect	affect	affect	Also could you explain more why you used an average of your three scenarios, wouldn't it be better to leave them separated to show how the growth rates would [MASK] the present value?
Effect,affect,effect	effect	affect	affect	Although Gaga didn’t win the Oscar for Best Original Song that night, her performance and advocacy showed that she was on track to become a powerful force in this space, using her platform to raise awareness and [MASK] change.
Effect,affect,effect	effect	affect	affect	Amo said: "I live by the principle of being in control of the narrative and [MASK] of my disability i.e. Amo Raju has cerebral palsy.
Effect,affect,effect	effect	affect	affect	And clearly, there'll be an earned [MASK] in 2022.
Being,begin,being	begin	being	being	According towill [MASK] shooting in the summer of this year.
Being,begin,being	begin	being	being	A full house is expected tonight when the No. 1-ranked Cougars [MASK] Big 12 play against the TCU Horned Frogs.
Being,begin,being	begin	being	being	Als wetenschapper is Kibbelaar daar vanaf het [MASK] bij betrokken.
bitch,pitch	bitch	pitch	pitch	He called Ms. Pinkett Smith “[MASK]” (and had something similar to say about Will Smith).
bitch,pitch	bitch	pitch	pitch	IRISH handler Mick Burke, of Hollywood village in west County Wicklow, starred at Skipton Auction Mart’s September timed online sale of working sheep dogs when claiming £4,900 top price with a well-bred black and white [MASK] related to top trials dogs.
bitch,pitch	bitch	pitch	pitch	MJF fired back with his usual justification about how only scumbags succeed in wrestling, and said Allin will only be remembered as “Sting’s [MASK]”.
bitch,pitch	bitch	pitch	pitch	One has a strong American southern accent, and the other had that accent, before she covered it in what the movie calls the “rich [MASK]” voice.
bitch,pitch	bitch	pitch	pitch	Or when he later struck out power hitter Bobby Dalbec, beat his own chest and repeated the sentiment, adding “[MASK]” for emphasis.
bitch,pitch	bitch	pitch	pitch	They talmbout Disney just announced toy story 5… [MASK] Andy damn near a senior citizen— MS.
bitch,pitch	bitch	pitch	pitch	This is a [MASK] that established a quite remarkable eight-in-a row and she has won eleven of her last thirteen races, including Corn Cuchulainn.
bitch,pitch	pitch	bitch	bitch	After he was hit by the [MASK], Harper got attention from a team trainer for a couple of minutes, then headed to first.
bitch,pitch	pitch	bitch	bitch	“All of our losses (overseas), like Cardiff in the rain and Glasgow (Warriors) on the 4G ([MASK]), those were technical problems.
bitch,pitch	pitch	bitch	bitch	And, to rub salt into the wound, the visitors broke up the [MASK] to score on the counter through James Forrest.
bitch,pitch	pitch	bitch	bitch	And whether you get a swing and miss or get hit, I (used to not) know if maybe I just got lucky on the one [MASK].
bitch,pitch	pitch	bitch	bitch	As one of Delaware’s oldest [MASK] competitions, this competition has showcased the ingenuity of over 110 Delaware entrepreneurs and invested over $125,000 in local start-ups.
bitch,pitch	pitch	bitch	bitch	As with LaBounty, DeSantis’ own [MASK] offers clues to what’s really going on with his scam.
brakes,breaks	brakes	breaks	breaks	After Pickett briefly [MASK] away from the family, he walks through the forest, seeing animals that have perished from Jason’s use of poisons as a means of noise control, all casualties of a brewing war between nature and humanity.
brakes,breaks	brakes	breaks	breaks	"At least now I have [MASK], and my chain isn't slipping.
brakes,breaks	brakes	breaks	breaks	Attention to detail: From adjusting [MASK] to fine-tuning derailleurs, attention to detail is critical.
brakes,breaks	brakes	breaks	breaks	Australia did not hold back as they began their response, keeping up the positive approach that has been a hallmark throughout the series, but Jansen took two wickets in the fourth over, dismissing David Warner and Josh Inglis to apply the [MASK].
brakes,breaks	brakes	breaks	breaks	Fifteen heats of four laps, each race lasting less than a minute with two riders from two teams racing off against each other in the quest for points on bikes with no [MASK], reaching speeds of up to 60mph.
brakes,breaks	brakes	breaks	breaks	These companies want the freedom to innovate without too many [MASK] and to market their products.
brakes,breaks	brakes	breaks	breaks	Verstappen tells his team that his [MASK] are going away from him.
brakes,breaks	breaks	brakes	brakes	According to the Tribune, the suit alleges the Madonna Inn failed to properly pay at least three employees the entirety of their wages, provide [MASK] and maintain payroll records.
brakes,breaks	breaks	brakes	brakes	Also, they are working on the replacement of the waterline on Blairmont Road, where all the [MASK] keep happening.
brakes,breaks	breaks	brakes	brakes	AMAR Law Firm & Public Interest Law Office said IMIP workers experienced poor workplace conditions including a lack of proper safety and respiratory gear, working long hours without [MASK], and pay cuts.
brakes,breaks	breaks	brakes	brakes	As the play begins, Herbert looks at that concept, and the safety [MASK] in that direction.
brakes,breaks	breaks	brakes	brakes	A vote to formalize the impeachment inquiry of President Biden is likely to come before the House of Representatives [MASK] for the December recess, multiple Republicans said Friday.
brakes,breaks	breaks	brakes	brakes	Despite this, however, not all are privileged or fortunate enough to go on leave or have [MASK].
brakes,breaks	breaks	brakes	brakes	"Drivers deliver at their own pace and take [MASK] at their discretion and this is clearly communicated during training.
Capital,Capitol,capital	Capital	Capitol	Capitol	A file photo from the women’s [MASK] Hoops Classic basketball game in 2020.
Capital,Capitol,capital	Capital	Capitol	Capitol	All these are attributable to excessive abuse of powers by the central government at [MASK] Hill.
Capital,Capitol,capital	Capital	Capitol	Capitol	Among others, it was envisaged that with the new system accounting officers would be preparing staff salaries at their respective LGAs instead of traveling to [MASK] Hill in Lilongwe every month to process the same.
Capital,Capitol,capital	Capital	Capitol	Capitol	An exhibit on Ruth Bader Ginsburg at the new [MASK] Jewish Museum in Washington, D.C., June 1, 2023.
Capital,Capitol,capital	Capitol	capital	capital	Above all, he is deliberately engaging in destructive propaganda as we saw in the January 6, 2022 mob revolt and invasion of the US [MASK].
Capital,Capitol,capital	Capitol	capital	capital	Accepting this premise would open the door to allowing anyone who was even near the [MASK] on that day to be barred from holding any public office for the rest of their lives.
Capital,Capitol,capital	Capitol	capital	capital	According to a timeline of events — compiled by the Justice Department and upon which Chansley signed off as part of his guilty plea — the Navy veteran from Arizona was one of the first 30 rioters to enter the [MASK] around 2:14 p.m. Jan.
Capital,Capitol,capital	Capitol	Capital	capital	Across the [MASK], issues are transferring even slower.
Capital,Capitol,capital	Capitol	capital	capital	Across the [MASK], issues are transferring even slower.
Capital,Capitol,capital	Capitol	capital	capital	A federal judge in Washington is threatening to report two attorneys for possible disciplinary action for delaying the trial of a man waiting in jail on charges that he assaulted police officers during the [MASK] riot.
Capital,Capitol,capital	Capitol	Capital	capital	A federal judge ruled that despite the public’s right to know about the contents of the footage, the videos could only be released on a case-by-case basis after the footage had been played in court during the cases against [MASK] insurrection defendants.
Capital,Capitol,capital	Capitol	capital	capital	A federal judge ruled that despite the public’s right to know about the contents of the footage, the videos could only be released on a case-by-case basis after the footage had been played in court during the cases against [MASK] insurrection defendants.
Capital,Capitol,capital	Capitol	Capital	capital	After citing instances when Trump called for peaceful actions and eventually asked those who forced their way into the [MASK] to go home, the response brief argues that nothing he did could be defined as “engaging in insurrection.
Capital,Capitol,capital	Capitol	capital	capital	After citing instances when Trump called for peaceful actions and eventually asked those who forced their way into the [MASK] to go home, the response brief argues that nothing he did could be defined as “engaging in insurrection.
Capital,Capitol,capital	Capitol	capital	capital	After the January 6 [MASK] riot in 2021, Mace professed to believe that former president needed to be held “accountable,” and opined that “his entire legacy was wiped out.”
Capital,Capitol,capital	Capitol	Capital	Capital	Among the findings: The [MASK] Forum and ProPublica identified 12 insurance company doctors with either a history of multiple malpractice payments, a single payment in excess of $1 million or a disciplinary action by a state medical board.
Capital,Capitol,capital	Capitol	capital	Capital	Among the findings: The [MASK] Forum and ProPublica identified 12 insurance company doctors with either a history of multiple malpractice payments, a single payment in excess of $1 million or a disciplinary action by a state medical board.
Capital,Capitol,capital	Capitol	Capital	Capital	And don’t ask us about the [MASK] Police chief who tells you Jan.
Capital,Capitol,capital	Capitol	capital	capital	Angry GOP lawmakers complained that local officials were en route to the [MASK] and accused Pappas of retribution and unethical conduct.
Capital,Capitol,capital	Capitol	capital	capital	Arkansas Gov. Sarah Huckabee Sanders signs legislation at the state [MASK] in Little Rock, Ark., on Monday, April 10, 2023, that will cut individual and corporate income taxes by $124 million a year.
Capital,Capitol,capital	Capitol	Capital	Capital	A spokesman for the firm said all Granite City staff would be moving into The [MASK] over the summer, most likely in July.
Capital,Capitol,capital	Capitol	Capital	capital	As Russell James Peterson, a rioter who pleaded guilty to “parading, demonstrating, or picketing” in the [MASK], on Dec. 4, 2020, “the only way to restore balance and peace is through war.
Capital,Capitol,capital	Capitol	capital	capital	As Russell James Peterson, a rioter who pleaded guilty to “parading, demonstrating, or picketing” in the [MASK], on Dec. 4, 2020, “the only way to restore balance and peace is through war.
Capital,Capitol,capital	Capitol	capital	capital	As the chants echoed throughout the [MASK], Jones, Johnson and Pearson approached the front of the House chamber with a bullhorn.
Capital,Capitol,capital	Capitol	Capital	Capital	At his desk at EDD headquarters lofted above the [MASK] Mall, Sheehan recalls wading through up to 300 alerts per day for potential unemployment fraud.
Capital,Capitol,capital	Capitol	capital	capital	At least some of the people who broke into the [MASK] had the intent of hunting down lawmakers and stopping the constitutional process of formally (and entirely ceremonially) completing the presidential and vice-presidential elections.
Capital,Capitol,capital	Capitol	Capital	Capital	Back in 2011 the [MASK] Guardian ran a story with a headline, “Petraeus in profile: the man who could be president.”
Capital,Capitol,capital	Capitol	capital	Capital	Back in 2011 the [MASK] Guardian ran a story with a headline, “Petraeus in profile: the man who could be president.”
Capital,Capitol,capital	Capitol	capital	capital	Bannon defied a subpoena from the House select committee that investigated the attack on the [MASK].
Capital,Capitol,capital	Capitol	Capital	capital	Before Thursday, the longest sentence in the more than 1,000 [MASK] riot cases was 14 years and two months for a man with a long criminal record who attacked police officers with pepper spray and a chair as he stormed the Capitol.
Capital,Capitol,capital	Capitol	capital	capital	Before Thursday, the longest sentence in the more than 1,000 [MASK] riot cases was 14 years and two months for a man with a long criminal record who attacked police officers with pepper spray and a chair as he stormed the Capitol.
Capital,Capitol,capital	Capitol	Capital	capital	Before Thursday, the longest sentence in the more than 1,000 [MASK] riot cases was 14 years and two months for a man with a long criminal record who attacked police officers with pepper spray and a chair as he stormed the Capitol.
Capital,Capitol,capital	Capitol	capital	capital	Before Thursday, the longest sentence in the more than 1,000 [MASK] riot cases was 14 years and two months for a man with a long criminal record who attacked police officers with pepper spray and a chair as he stormed the Capitol.
Capital,Capitol,capital	Capitol	capital	capital	Be there, will be wild!” and then decided to travel to the [MASK] in order to “intimidate Congress.”
Capital,Capitol,capital	Capitol	Capital	capital	Brooks’ opinion of Shelby is rare among thinking individuals in Alabama and the nation’s [MASK].
Capital,Capitol,capital	Capitol	capital	capital	Brooks’ opinion of Shelby is rare among thinking individuals in Alabama and the nation’s [MASK].
Capital,Capitol,capital	Capitol	Capital	capital	But I also have been wondering how he would react to the foolishness that is going on at our state [MASK] in the name of Republican conservatism.
Capital,Capitol,capital	Capitol	capital	capital	But I also have been wondering how he would react to the foolishness that is going on at our state [MASK] in the name of Republican conservatism.
Capital,Capitol,capital	Capitol	Capital	Capital	But they continued to appear on the network to promote falsehoods in the weeks leading up to the insurrection at the [MASK] on Jan.
Capital,Capitol,capital	Capitol	capital	capital	But they continued to appear on the network to promote falsehoods in the weeks leading up to the insurrection at the [MASK] on Jan.
Capital,Capitol,capital	Capitol	Capital	capital	By the time fire crews arrived, the blaze had engulfed the house on Normanskill Road in the town of New Scotland, about 8 miles (13 kilometers) west of New York’s [MASK].
Capital,Capitol,capital	Capitol	capital	capital	By the time fire crews arrived, the blaze had engulfed the house on Normanskill Road in the town of New Scotland, about 8 miles (13 kilometers) west of New York’s [MASK].
Capital,Capitol,capital	Capitol	Capital	Capital	[MASK] dome with an American flag waving in the wind.
Capital,Capitol,capital	Capitol	Capital	Capital	[MASK] Federal Financial () last issued its earnings results on Wednesday, July 26th.
Capital,Capitol,capital	Capitol	capital	Capital	[MASK] Federal Financial () last issued its earnings results on Wednesday, July 26th.
Capital,Capitol,capital	Capitol	Capital	Capital	[MASK] Police Lawyer Slams House GOP on Jan.
Capital,Capitol,capital	Capitol	Capital	Capital	[MASK] riot that took place on January 6, 2021.
Capital,Capitol,capital	Capitol	capital	capital	[MASK] riot that took place on January 6, 2021.
Capital,Capitol,capital	Capitol	Capital	capital	“Civilian online investigators” initially identified DiGiovanni entering the [MASK], according to a statement from federal prosecutors.
Capital,Capitol,capital	Capitol	capital	capital	“Civilian online investigators” initially identified DiGiovanni entering the [MASK], according to a statement from federal prosecutors.
Capital,Capitol,capital	Capitol	capital	capital	Cutter, Lynch, Snyder and Sen. Sonya Jaquez Lewis shepherded that measure through the [MASK].
Capital,Capitol,capital	Capitol	Capital	Capital	Democratic Rep. Ronnie Crudup Jr. of Jackson said the expanded [MASK] Complex district would encompass the city’s more affluent areas.
Capital,Capitol,capital	Capitol	Capital	Capital	Downtown Honolulu technically spans Chinatown and the [MASK] District, but the influx of money has been concentrated in its central business district.
Capital,Capitol,capital	Capitol	capital	Capital	Downtown Honolulu technically spans Chinatown and the [MASK] District, but the influx of money has been concentrated in its central business district.
Capital,Capitol,capital	Capitol	Capital	capital	During the trip to the [MASK], Abulaban and ASO Public Relations Director Sabrina Rashiq introduced a higher education bill for refugee students to pay tuition fees as residents rather than international students to Padilla’s staff members.
Capital,Capitol,capital	Capitol	capital	capital	During the trip to the [MASK], Abulaban and ASO Public Relations Director Sabrina Rashiq introduced a higher education bill for refugee students to pay tuition fees as residents rather than international students to Padilla’s staff members.
Capital,Capitol,capital	Capitol	capital	capital	Eventually, he was revealed to be Michael Byrd, whose problematic record as a police officer included leaving his loaded weapon unattended in a [MASK] building bathroom.
Capital,Capitol,capital	Capitol	Capital	Capital	Ex-[MASK] police chief blames government agencies for failed Jan.
Capital,Capitol,capital	Capitol	capital	capital	Ex-[MASK] police chief blames government agencies for failed Jan.
Capital,Capitol,capital	Capitol	capital	capital	“Feels like Christmas at the [MASK] — unwrapping fresh, new bill language and ready to drop them in the hopper soon!”
Capital,Capitol,capital	Capitol	capital	capital	FILE - Demonstrators protest outside the state [MASK] in Madison, Wis., on May 3, 2022, in response to the news that the U.S. Supreme Court could be poised to overturn the landmark Roe v. Wade case that legalized abortion nationwide.
Capital,Capitol,capital	capital	Capitol	Capitol	A [MASK] outlay package includes some big-ticket items for Albuquerque, but New Mexico Gov. Michelle…
Capital,Capitol,capital	capital	Capitol	Capitol	A haze hung over the nation’s [MASK].
Capital,Capitol,capital	capital	Capitol	Capitol	Also in the state [MASK] it was reported that a young couple had a fight on the day of their wedding reception.
Site,sight,site	Site	sight	sight	Click [MASK] Settings from the list below and scroll down to Pop-ups and redirects.
Site,sight,site	Site	sight	sight	Take it and sit on a [MASK] of Lost grace, which is a few steps ahead.
Site,sight,site	sight	site	site	ABERDAM will be bringing their custom-built ‘Scran Van’ to Taste of Grampian, a familiar [MASK] to those from the shire.
Site,sight,site	sight	site	site	A﻿fter months of skyrocketing there may be some relief in [MASK] – at least in the long term – with a "significant" drop in prices forecast for some Australian states.
Site,sight,site	sight	site	site	AI continues to incur persistent net losses with no clear resolution in [MASK].
Site,sight,site	sight	site	site	A player whose injury record was a concern going down with any sort of problem was not a [MASK] anyone associated with Leeds wanted.
Site,sight,site	sight	site	site	As Reach makes more job cuts on local titles, is a sustainable future in [MASK] for local journalism to hold power to account?
Site,sight,site	sight	site	site	Chris Christie has become a regular [MASK] all over New Hampshire.
Country,County,country,county	Country	County	County	Additionally, [MASK] on Court: Pickleball at CMA Fest, presented by and DINK, the “official drink of pickleballers,” will take place on Thursday, June 8, at Fan Fair X inside Music City Center.
Country,County,country,county	Country	county	County	Additionally, [MASK] on Court: Pickleball at CMA Fest, presented by and DINK, the “official drink of pickleballers,” will take place on Thursday, June 8, at Fan Fair X inside Music City Center.
Country,County,country,county	Country	County	County	A decision on the Flow [MASK]'s nomination is expected next year.
Country,County,country,county	Country	county	County	A decision on the Flow [MASK]'s nomination is expected next year.
