confusion_set	expected	target	suggestion	masked_sentence
Lead,Led,lead,led	lead	Lead	led	A labyrinth of underground passport control booths and passageways [MASK] cruise ship passengers to tour buses that spirit them across the city on day trips, mostly to major sites far from the port.
To,Too,Two,to,too,two	to	To	too	And free agency has given us the ability in areas [MASK], man, we can do whatever we need to do in the draft.
To,Too,Two,to,too,two	to	Two	too	And free agency has given us the ability in areas [MASK], man, we can do whatever we need to do in the draft.
To,Too,Two,to,too,two	to	two	too	And free agency has given us the ability in areas [MASK], man, we can do whatever we need to do in the draft.
Country,County,country,county	county	County	country	An Officer of the OBE is awarded for distinguished regional or [MASK]-wide role in any field, through achievement or service to the community.
Their,There,They,their,there,they	their	Their	there	Anonymous tips can be submitted through Fayetteville / Cumberland County Crime Stoppers by calling (910) 483-8477 or electronically on [MASK] and completing the anonymous online tip sheet.
Their,There,They,their,there,they	their	They	there	Anonymous tips can be submitted through Fayetteville / Cumberland County Crime Stoppers by calling (910) 483-8477 or electronically on [MASK] and completing the anonymous online tip sheet.
Country,County,country,county	county	County	country	"As the [MASK]'s Destination Management Organisation, we trust in the planning process to ensure a decision that balances all these important factors."
Than,Then,than,then	then	Then	than	Bob MacIntyre aims to use next week’s BMW PGA Championship to initially “pick the brains” of his Ryder Cup team-mates [MASK] “beat their brains out” on the iconic West Course at Wentworth.
To,Too,Two,to,too,two	to	To	too	But if you look at the media this story was leaked [MASK] I see dirty Democrat fingerprints everywhere.
To,Too,Two,to,too,two	to	Two	too	But if you look at the media this story was leaked [MASK] I see dirty Democrat fingerprints everywhere.
To,Too,Two,to,too,two	to	two	too	But if you look at the media this story was leaked [MASK] I see dirty Democrat fingerprints everywhere.
Than,Then,than,then	then	Then	than	But [MASK] the next quarter, they spend more.
Their,There,They,their,there,they	they	Their	there	But [MASK] are two distinct and separate occurrences.
Their,There,They,their,there,they	they	They	there	But [MASK] are two distinct and separate occurrences.
Their,There,They,their,there,they	they	their	there	But [MASK] are two distinct and separate occurrences.
Country,County,country,county	county	County	country	By July 1, the new carts will be the only acceptable container permitted for recycling collection at single-family homes in the [MASK].
Form,From,form,from	form	Form	from	Crowds were entertained by the Broke FMX Motocross Stunt Team, as well as a crowd pleasing display [MASK] the Pony club Games.
Three,Tree,three,tree	three	Three	tree	Drew has the [MASK] up!
You,Your,you,your	You	you	Your	Each year, the Knock Knock What I Love About [MASK] Fill-in-the-Blank Book receives much acclaim — and for a good reason.
To,Too,Two,to,too,two	to	To	too	‘Get ready for us’: Wagner fighters send chilling revenge message [MASK]…
To,Too,Two,to,too,two	to	Two	too	‘Get ready for us’: Wagner fighters send chilling revenge message [MASK]…
To,Too,Two,to,too,two	to	two	too	‘Get ready for us’: Wagner fighters send chilling revenge message [MASK]…
Country,County,country,county	county	County	country	Henrico must continue to invest in the most up-to-date resources and infrastructure in its schools, and make sure to do so in both the east and west sides of the [MASK], Rogish said.
You,Your,you,your	you	You	your	“Here’s something I tell my guys all the time, ‘My job is to out-recruit [MASK]’.
You,Your,you,your	your	Your	you	However, the only condition is that you need to create a separate Wi-Fi network to which the devices that [MASK] kid – be it a smartphone, laptop, tablet, or even a smart TV, for that matter – are connected.
You,Your,you,your	you	You	your	“I can’t wait to go home…I deliberately arranged to be as far away as possible from [MASK] people.
Life,Live,life,live	life	Life	live	In 2014 they moved to Mauriceville TX. where they built a beautiful home and [MASK] together.
Word,World,word,world	word	Word	world	In a [MASK], they’re scared of a dictatorship, and they worry that if they wait, it may be too late.”
Principal,principal,principle	principal	Principal	principle	Investing involves risks, including possible loss of [MASK].
To,Too,Two,to,too,two	to	To	two	I remember the days where we used [MASK] Bluetooth songs to each other’s Blackberries and Tinchy’s Number 1 and Never Leave You were played on repeat.
To,Too,Two,to,too,two	to	Too	two	I remember the days where we used [MASK] Bluetooth songs to each other’s Blackberries and Tinchy’s Number 1 and Never Leave You were played on repeat.
To,Too,Two,to,too,two	to	too	two	I remember the days where we used [MASK] Bluetooth songs to each other’s Blackberries and Tinchy’s Number 1 and Never Leave You were played on repeat.
Their,There,They,their,there,they	they	Their	there	Ironically, both teens are mysteriously impervious to Eida's spell, which makes it seem like [MASK]'d be rogues immediately working to help Boruto.
Their,There,They,their,there,they	they	They	there	Ironically, both teens are mysteriously impervious to Eida's spell, which makes it seem like [MASK]'d be rogues immediately working to help Boruto.
Their,There,They,their,there,they	they	their	there	Ironically, both teens are mysteriously impervious to Eida's spell, which makes it seem like [MASK]'d be rogues immediately working to help Boruto.
To,Too,Two,to,too,two	too	Too	to	It could happen in the way that it’s subtly planted and then, I hope not [MASK] over the top, acting- and camera-wise.”
To,Too,Two,to,too,two	too	Two	to	It could happen in the way that it’s subtly planted and then, I hope not [MASK] over the top, acting- and camera-wise.”
To,Too,Two,to,too,two	too	two	to	It could happen in the way that it’s subtly planted and then, I hope not [MASK] over the top, acting- and camera-wise.”
Form,From,form,from	from	From	form	Manchester United announced they had accepted a £25million bid [MASK] for David Beckham on this day in 2003.
Their,There,They,their,there,they	their	Their	there	Many open from 8 or 9am but you can refer to [MASK] to confirm if your local restaurant is open during the Christmas period and what times they are trading.
Their,There,They,their,there,they	their	They	there	Many open from 8 or 9am but you can refer to [MASK] to confirm if your local restaurant is open during the Christmas period and what times they are trading.
To,Too,Two,to,too,two	two	Too	to	NEW food hygiene ratings have been awarded to a Halesowen dessert shop and [MASK] other establishments, the Food Standards Agency’s website shows.
To,Too,Two,to,too,two	two	Two	to	NEW food hygiene ratings have been awarded to a Halesowen dessert shop and [MASK] other establishments, the Food Standards Agency’s website shows.
To,Too,Two,to,too,two	two	too	to	NEW food hygiene ratings have been awarded to a Halesowen dessert shop and [MASK] other establishments, the Food Standards Agency’s website shows.
You,Your,you,your	your	Your	you	Next thing [MASK] going to post is that chopping the foreskin of babies isn't a symbol of virtuous enlightenment.
Except,accept,except	except	Except	accept	"Nkunku, it is like a new signing because we didn’t use [MASK] for pre-season.
Them,Theme,them,theme	theme	Theme	them	Now we get to the timeliness — and Novey’s knack for being on [MASK] without ever being too on the nose.
To,Too,Two,to,too,two	too	To	two	Now we get to the timeliness — and Novey’s knack for being on theme without ever being [MASK] on the nose.
To,Too,Two,to,too,two	too	Too	two	Now we get to the timeliness — and Novey’s knack for being on theme without ever being [MASK] on the nose.
Lead,Led,lead,led	lead	Lead	led	Our study of market events and our own investment experience [MASK] us to conclude that the greatest potential risk for value destruction in asset allocation is through acquisitions.
You,Your,you,your	you	You	your	Probably not a real good look for [MASK] trade demand that you’re posting a pic excited with OBJ being a Raven.
Effect,affect,effect	effect	Effect	affect	Psychologists say it's this curious [MASK] - coupled with the acute emotion - that keeps a recently-ended romance in the forefront of your mind.
To,Too,Two,to,too,two	two	Too	to	She also helped lead the girls basketball and softball teams [MASK] section championships.
To,Too,Two,to,too,two	two	Two	to	She also helped lead the girls basketball and softball teams [MASK] section championships.
To,Too,Two,to,too,two	two	too	to	She also helped lead the girls basketball and softball teams [MASK] section championships.
Hole,Whole,hole,whole	whole	Whole	hole	That's the [MASK] in the end: A single guess provides you with information that you then need to use to narrow down the list of subsequent guesses.
Country,County,country,county	country	Country	county	The history and projections of the new marker prices show that they are superior to Henry Hub and will generate greater revenues for the [MASK].”
Country,County,country,county	County	county	Country	The owner of the address, in Princess Close, has escaped injury, Hampshire and Isle of Wight Fire and Rescue Service has told the [MASK] Press.
To,Too,Two,to,too,two	to	To	too	The president will travel [MASK]…
To,Too,Two,to,too,two	to	Two	too	The president will travel [MASK]…
To,Too,Two,to,too,two	to	two	too	The president will travel [MASK]…
Life,Live,life,live	live	Live	life	Therefore, 's faithfulness to its source material, stellar performances, and strong visuals allow it to break the curse of disappointing anime [MASK] actions for Netflix.
Form,From,form,from	from	From	form	The response, he said, needs to [MASK] within.
To,Too,Two,to,too,two	two	Too	to	The spokesperson said: "There are three options to supportsafer crossings on St Leonard's Road [MASK] options for cyclists and pedestrians at the roundabout and proposals for two junctions on the Grantown Road.
To,Too,Two,to,too,two	two	Two	to	The spokesperson said: "There are three options to supportsafer crossings on St Leonard's Road [MASK] options for cyclists and pedestrians at the roundabout and proposals for two junctions on the Grantown Road.
To,Too,Two,to,too,two	two	too	to	The spokesperson said: "There are three options to supportsafer crossings on St Leonard's Road [MASK] options for cyclists and pedestrians at the roundabout and proposals for two junctions on the Grantown Road.
Word,World,word,world	word	Word	world	The Springboks have to be on the money from the [MASK] go as they will begin their Rugby World Cup on Sunday 10 September against Scotland.
Their,There,They,their,there,they	They	Their	There	[MASK] are separating families.
Their,There,They,their,there,they	They	their	There	[MASK] are separating families.
Their,There,They,their,there,they	They	Their	There	[MASK] were suspected bodies of soldiers killed in a then recent attack on the Melete barracks.
Their,There,They,their,there,they	They	their	There	[MASK] were suspected bodies of soldiers killed in a then recent attack on the Melete barracks.
Their,There,They,their,there,they	They	they	There	[MASK] were suspected bodies of soldiers killed in a then recent attack on the Melete barracks.
You,Your,you,your	you	You	your	“This year we said (to companies) that ‘if you don’t have even one woman on the board, we will vote against [MASK]’.
To,Too,Two,to,too,two	to	To	two	To see more or [MASK] join, visit the Leader Camera Club Facebook group.
To,Too,Two,to,too,two	to	Too	two	To see more or [MASK] join, visit the Leader Camera Club Facebook group.
To,Too,Two,to,too,two	to	too	two	To see more or [MASK] join, visit the Leader Camera Club Facebook group.
Country,County,country,county	county	County	country	We followed what the state and [MASK] required us to follow,” he said.
Their,There,They,their,there,they	their	Their	there	While 12 G20 nations managed to slash per capita coal emissions, others including India and China saw [MASK]'s rise.
Their,There,They,their,there,they	their	They	there	While 12 G20 nations managed to slash per capita coal emissions, others including India and China saw [MASK]'s rise.
Trail,Trial,trail,trial	trail	Trail	trial	While the conviction of the 47 suspects on money laundering violations in US courts was successful, the [MASK] of illicit fund transfers indicates legal and enforcement loopholes on the Kenyan side.
